number,value,params_max_depth,params_max_features,params_min_samples_leaf,params_min_samples_split,params_n_estimators,user_attrs_mae_per_fold,user_attrs_mape_per_fold,user_attrs_r2_per_fold,user_attrs_rmse_per_fold,state
0,12.588363314113746,30.0,sqrt,18,17,500,"[12.380355771697708, 12.414341496342555, 12.949096255753762, 12.397220089343387, 12.800802957431321]","[0.44374223102942784, 0.44692492051603433, 0.4987806134951112, 0.44191193909520987, 0.43528234480826483]","[0.5902716948766475, 0.5670977134034192, 0.5410689090377139, 0.6072591413495332, 0.579984674012207]","[19.017420479539325, 19.419063315896306, 19.252846540165233, 17.502913561536197, 19.46171501953954]",COMPLETE
1,12.539978971528674,30.0,log2,13,16,300,"[12.323121459607835, 12.35133958616708, 12.956483880345157, 12.325463318150154, 12.74348661337314]","[0.4425750107074658, 0.44722277481154116, 0.5012528511927065, 0.4402542176503635, 0.4340788800038211]","[0.5948662862774137, 0.5718512080039948, 0.542954189264799, 0.6109668818452554, 0.5840895492829347]","[18.910491551984755, 19.312153263612664, 19.21326067941778, 17.420097942201878, 19.366380329725704]",COMPLETE
2,12.583298751089973,,log2,19,15,800,,,,,PRUNED
3,12.220627284569842,30.0,log2,7,16,800,"[12.045501668459341, 12.058563552130718, 12.550123502053955, 11.995284633421901, 12.453663066783292]","[0.4268944088695943, 0.43081787765119534, 0.4790218516465385, 0.42247529688804597, 0.41768866484405515]","[0.6058242867145675, 0.5852470270921459, 0.5545828635719519, 0.6225014089566324, 0.5954035185702276]","[18.6529942534501, 19.007635350568272, 18.967263151794103, 17.159908702215894, 19.10115332973318]",COMPLETE
4,12.080540485542503,20.0,sqrt,7,7,300,"[11.86550210685697, 11.935319439001555, 12.391818603542937, 11.881421182330662, 12.328641095980387]","[0.41625010220114933, 0.4224611979166488, 0.46968793069158254, 0.41676120942646344, 0.4099553132398945]","[0.6102307277921555, 0.5905876435971975, 0.558348104282419, 0.6254715423348799, 0.5994825017156035]","[18.54844148990922, 18.88486179232797, 18.886925112965795, 17.09226889268067, 19.00462425072886]",COMPLETE
5,11.787617001339584,,log2,1,3,800,"[11.591601728891261, 11.656417123523683, 12.072506081718403, 11.524601103107969, 12.092958969456605]","[0.4029455738166593, 0.4088529319373911, 0.4561904293862616, 0.39991808519000405, 0.3954234531738464]","[0.6265556724928141, 0.605370995414134, 0.5674521936916218, 0.6357925616522793, 0.6083830526548353]","[18.155848864215013, 18.540773091269333, 18.691246533869627, 16.855114652225403, 18.792271526459608]",COMPLETE
6,12.018160685139637,20.0,sqrt,7,4,800,,,,,PRUNED
7,11.775496866819232,20.0,sqrt,1,11,500,,,,,PRUNED
8,11.929685482200888,,sqrt,4,17,300,,,,,PRUNED
9,12.023296607148945,20.0,log2,5,11,500,,,,,PRUNED
10,12.005352934347112,10.0,0.5,14,2,800,,,,,PRUNED
11,11.948086070470232,,1.0,1,6,300,"[11.798016496196457, 11.795171290087893, 11.959269190032787, 11.931965272744078, 12.256008103289942]","[0.3987974727553636, 0.4059301782599093, 0.4432332235682023, 0.40596805521484275, 0.39662586100319747]","[0.6067475856551503, 0.5977591881853376, 0.5573867207701337, 0.6000058938571775, 0.5950676627048717]","[18.631135490651527, 18.718731037947002, 18.907470374978573, 17.663798482680807, 19.109079626555705]",COMPLETE
12,11.871105562265305,,1.0,1,6,300,,,,,PRUNED
13,11.825031756751638,,1.0,3,8,300,"[11.669499070542873, 11.74553836444789, 11.855819394312897, 11.73930874776142, 12.114993206693113]","[0.3909952668265756, 0.40001134240248465, 0.43334382160861756, 0.3979344869015549, 0.3903707760514187]","[0.6109399678020522, 0.5990294320218423, 0.5624511206995004, 0.6105141990467751, 0.5986612289532709]","[18.531558056948327, 18.689151550404766, 18.798989131149142, 17.43023009504373, 19.024099039422122]",COMPLETE
14,11.805674423467195,,1.0,4,10,800,"[11.672641354783567, 11.719053945208803, 11.816634428668683, 11.70248462277572, 12.117557765899198]","[0.393086268406697, 0.3995968104413111, 0.4319971533061971, 0.39749014756830287, 0.3905932304632643]","[0.611212737183537, 0.5983862487021612, 0.5644991375500503, 0.6142007581519773, 0.5978624227767306]","[18.525060694707474, 18.704134862047184, 18.75494170447577, 17.34754370466433, 19.043021972852046]",COMPLETE
15,11.946127350896635,,0.5,10,20,800,"[11.770042005277906, 11.7915691497521, 12.123773453891193, 11.776031480639002, 12.269220664922976]","[0.4048462824775406, 0.4072904447332584, 0.4483898021590138, 0.4067750286297562, 0.40017391678871944]","[0.6087418744494273, 0.5972636154366819, 0.5616236048831773, 0.6195634901528819, 0.5972823555913374]","[18.583833694084102, 18.73025850762282, 18.81675756025182, 17.22655359935095, 19.05675141796889]",COMPLETE
16,11.882245272852746,10.0,1.0,4,11,800,,,,,PRUNED
17,12.28130324550229,,log2,9,2,800,,,,,PRUNED
18,11.815983056878853,,1.0,5,10,800,"[11.670820289734614, 11.7348613780958, 11.801528087363263, 11.725979839963177, 12.14672568923741]","[0.3928900859965036, 0.39943784286428585, 0.43127703892580954, 0.3984160509183642, 0.39085122473843753]","[0.6107569611669607, 0.5986718227035035, 0.565302398297549, 0.6129221243235696, 0.5967789292897216]","[18.535915995419806, 18.697483739569865, 18.73763741999979, 17.376266944310146, 19.068658859444096]",COMPLETE
19,11.822320680239192,10.0,0.5,3,14,800,,,,,PRUNED
20,11.814733082239922,,1.0,10,9,800,,,,,PRUNED
21,11.75512327861508,,1.0,6,13,800,,,,,PRUNED
22,11.804416203986728,,1.0,3,4,800,"[11.672602882325597, 11.721460692097203, 11.822301571072497, 11.709742554241878, 12.095973320196453]","[0.3920484783019585, 0.3998451823897452, 0.4325017681874071, 0.39561596679790534, 0.3892738947960093]","[0.6118173958342996, 0.5994314283665989, 0.5621997007863981, 0.6113002527356423, 0.5993502366024095]","[18.510649604289604, 18.679780719722707, 18.804389398030747, 17.412632513250458, 19.00776199289832]",COMPLETE
23,11.82224302738398,,1.0,2,4,800,"[11.675546541077251, 11.731206828445409, 11.86265848592521, 11.7543602966691, 12.087442984802925]","[0.3929314352581173, 0.4004473531688794, 0.4346541685342516, 0.39681179199071676, 0.38972629871771275]","[0.6136428758083625, 0.5996884909564213, 0.5597053424832261, 0.6089179102747069, 0.6006236665419116]","[18.46707392633516, 18.6737859365693, 18.857882125944922, 17.465912050965002, 18.977530704312628]",COMPLETE
24,11.840064532939607,,log2,3,4,800,,,,,PRUNED
25,11.733734730797105,,1.0,5,5,500,,,,,PRUNED
26,11.755943038029244,,1.0,2,2,800,,,,,PRUNED
27,12.463833009156279,10.0,log2,8,8,800,,,,,PRUNED
28,11.730018984096468,30.0,0.5,4,3,800,"[11.558302207885356, 11.620263880214473, 11.838119243449222, 11.58157801934348, 12.051831569589806]","[0.3926026232122053, 0.39926646373773444, 0.4364276534831409, 0.39638435632083235, 0.38967224939233264]","[0.6205331216585412, 0.607295744107399, 0.5678857446016043, 0.6251334914962018, 0.6058027835016542]","[18.30166335818923, 18.49550278853527, 18.68187688912347, 17.099980926946746, 18.854078746690433]",COMPLETE
29,11.86751802479337,30.0,0.5,12,3,500,,,,,PRUNED
30,12.00913761274414,30.0,0.5,17,5,800,,,,,PRUNED
31,11.730018984096468,30.0,0.5,4,3,800,"[11.558302207885356, 11.620263880214472, 11.838119243449222, 11.58157801934348, 12.051831569589806]","[0.3926026232122053, 0.39926646373773444, 0.4364276534831409, 0.39638435632083235, 0.38967224939233264]","[0.6205331216585412, 0.607295744107399, 0.5678857446016043, 0.6251334914962018, 0.6058027835016542]","[18.30166335818923, 18.49550278853527, 18.68187688912347, 17.099980926946746, 18.854078746690433]",COMPLETE
32,11.699453023604935,30.0,0.5,2,3,800,"[11.534236638297452, 11.594350630356695, 11.81672070208867, 11.554705374482992, 11.997251772798867]","[0.39074363862334466, 0.39742521650446033, 0.43644980406470557, 0.394648056902743, 0.38671196703314764]","[0.6219606774670701, 0.6081938223750019, 0.568704996529542, 0.6238493456348734, 0.6085170518277193]","[18.26720545713219, 18.47434193231238, 18.664158861223253, 17.129244805898065, 18.78905618516348]",COMPLETE
33,11.699453023604935,30.0,0.5,2,3,800,"[11.534236638297452, 11.594350630356693, 11.81672070208867, 11.554705374482994, 11.997251772798867]","[0.39074363862334466, 0.39742521650446033, 0.43644980406470557, 0.39464805690274307, 0.38671196703314764]","[0.62196067746707, 0.6081938223750017, 0.5687049965295419, 0.6238493456348734, 0.6085170518277193]","[18.267205457132192, 18.47434193231238, 18.664158861223257, 17.129244805898065, 18.78905618516348]",COMPLETE
34,11.793826756139852,30.0,0.5,6,5,800,"[11.655585229527098, 11.661625385228819, 11.902047006267606, 11.608103416666003, 12.141772743009732]","[0.3981924918670429, 0.40107834219544786, 0.43933471973390925, 0.3985082928829374, 0.3935060089396079]","[0.6154450044275119, 0.6055921057748558, 0.5684543735731895, 0.6237085379601159, 0.6016295304841908]","[18.423954569819536, 18.53557817226401, 18.669580889406177, 17.132450573887873, 18.95361735915824]",COMPLETE
35,11.699453023604935,30.0,0.5,2,3,800,"[11.534236638297452, 11.594350630356695, 11.81672070208867, 11.554705374482994, 11.997251772798867]","[0.39074363862334466, 0.39742521650446033, 0.43644980406470557, 0.39464805690274307, 0.38671196703314764]","[0.6219606774670701, 0.6081938223750019, 0.5687049965295419, 0.6238493456348734, 0.6085170518277193]","[18.26720545713219, 18.47434193231238, 18.664158861223257, 17.129244805898065, 18.78905618516348]",COMPLETE
36,11.708989061333126,30.0,0.5,2,6,800,"[11.578843034178451, 11.558548598314827, 11.808001742178353, 11.549356253966335, 12.050195678027663]","[0.39266973568099933, 0.39760387391640994, 0.4369022825632133, 0.3948140341639787, 0.3890267997414293]","[0.6200614296994109, 0.6092294610228453, 0.5693327904393499, 0.62439640100614, 0.6070379050422582]","[18.313034662107874, 18.449909695855446, 18.650570120120026, 17.11678429997911, 18.82451822780309]",COMPLETE
37,11.732976669369005,30.0,0.5,2,7,500,"[11.580798697003548, 11.589064192453021, 11.834883451848834, 11.593263480608165, 12.066873524931458]","[0.3934176913336096, 0.3985036567406231, 0.4384064091452524, 0.3964587819711756, 0.38853784286984094]","[0.6213917456135825, 0.6087698264456779, 0.5689493300484122, 0.62387516366462, 0.6071885624318341]","[18.280945942855542, 18.460757141348832, 18.658871383255534, 17.128656941786065, 18.820909324180224]",COMPLETE
38,11.708989061333126,30.0,0.5,2,6,800,"[11.578843034178451, 11.558548598314827, 11.808001742178353, 11.549356253966337, 12.050195678027663]","[0.39266973568099933, 0.39760387391641, 0.43690228256321334, 0.3948140341639787, 0.38902679974142934]","[0.6200614296994109, 0.6092294610228453, 0.5693327904393499, 0.62439640100614, 0.6070379050422582]","[18.313034662107874, 18.449909695855446, 18.650570120120022, 17.11678429997911, 18.82451822780309]",COMPLETE
39,11.793199541962496,30.0,0.5,1,7,800,"[11.65619835296945, 11.646618968831156, 11.8689189326334, 11.672754405022067, 12.121507050356398]","[0.3976842979487948, 0.403597670008974, 0.4429904497728317, 0.40187878777322655, 0.392431110597318]","[0.6184621374253672, 0.6059878408676818, 0.5669236551628503, 0.621074307844304, 0.6082482976807695]","[18.351537121617206, 18.52627686295308, 18.702662645330086, 17.192313887891792, 18.795504448670858]",COMPLETE
40,11.795333097584363,30.0,0.5,6,2,300,"[11.629333109684056, 11.668129076599003, 11.904795289880019, 11.636473470722756, 12.13793454103598]","[0.39729244156594107, 0.4012442112943023, 0.4383841205508133, 0.40010515315860723, 0.3930758998238608]","[0.6168246927166591, 0.6058164696116926, 0.5679130973458051, 0.6223311224292642, 0.601735607606882]","[18.390874574501936, 18.530305325168573, 18.68128560026853, 17.163778613087736, 18.95109372951384]",COMPLETE
41,11.708989061333126,30.0,0.5,2,6,800,"[11.57884303417845, 11.558548598314827, 11.808001742178353, 11.549356253966337, 12.050195678027663]","[0.39266973568099933, 0.39760387391641, 0.43690228256321334, 0.3948140341639787, 0.3890267997414293]","[0.6200614296994109, 0.6092294610228454, 0.5693327904393499, 0.62439640100614, 0.6070379050422582]","[18.313034662107874, 18.449909695855442, 18.650570120120026, 17.11678429997911, 18.82451822780309]",COMPLETE
42,11.706185566877057,30.0,0.5,2,5,800,"[11.534881810222487, 11.562449428129794, 11.83611179792252, 11.56200202209981, 12.035482776010673]","[0.39034952397646633, 0.3968703176029114, 0.4372405888045632, 0.3952902575596529, 0.387453019230099]","[0.6218126461058515, 0.6096546901491222, 0.566385322639336, 0.6242679587189465, 0.6062950850407705]","[18.270781612392575, 18.439868541682063, 18.71428314229784, 17.11971069766304, 18.84230191090893]",COMPLETE
43,11.774467402912908,30.0,0.5,1,5,800,"[11.602804587003057, 11.565720276835433, 11.890503717828583, 11.678723116507054, 12.1345853163904]","[0.3963420075858839, 0.4000543452218302, 0.4435419793035711, 0.400892885308103, 0.3921380850768662]","[0.6211219623726231, 0.6102990534234565, 0.5644576763059708, 0.6196592657568238, 0.6055929195002699]","[18.287457970162986, 18.42464243114455, 18.7558344520866, 17.224385054290867, 18.859096876893076]",COMPLETE
44,12.083514565586494,30.0,0.5,20,4,800,,,,,PRUNED
45,11.747173289403346,30.0,sqrt,3,3,800,,,,,PRUNED
46,11.786260203204723,20.0,0.5,1,5,500,"[11.620093820367671, 11.647254783349485, 11.871482431554558, 11.663253610948091, 12.129216369803808]","[0.39591113087386937, 0.4026087888240913, 0.44293457636018335, 0.3993621391545021, 0.3924705215394401]","[0.6191787918810516, 0.6069560191795426, 0.5679237329249058, 0.6211816235443504, 0.6075082667012172]","[18.33429388868866, 18.503501205816313, 18.68105568411956, 17.18987919437778, 18.813248714911968]",COMPLETE
47,11.75964786630735,30.0,0.5,5,8,300,"[11.609913433840005, 11.623620415672352, 11.872593163212988, 11.630012084714412, 12.062100234096997]","[0.3952998680663454, 0.39872243104797067, 0.4365544682495021, 0.3983970370118312, 0.3886848406425832]","[0.6169841763683734, 0.6060541240577062, 0.5691466218990991, 0.6232669933299358, 0.604423708413025]","[18.387046889056133, 18.524718494321192, 18.654600812709912, 17.142499331936445, 18.887029878796373]",COMPLETE
48,11.703221435297488,30.0,0.5,3,3,800,"[11.529111427918503, 11.58655943060001, 11.814779391647662, 11.560357411583318, 12.025299514737943]","[0.391913642528305, 0.3977027394025938, 0.43658926695552636, 0.39453376946891916, 0.38831619612356205]","[0.6219661062765154, 0.6071688756075597, 0.568136334732618, 0.6236556826279112, 0.6064039052795422]","[18.267074294145107, 18.498490160292725, 18.67645914042118, 17.13365377627379, 18.839697720029964]",COMPLETE
49,11.747173289403346,30.0,sqrt,3,2,800,,,,,PRUNED
50,11.730018984096468,30.0,0.5,4,3,800,"[11.558302207885356, 11.620263880214472, 11.838119243449222, 11.58157801934348, 12.051831569589806]","[0.3926026232122053, 0.39926646373773444, 0.43642765348314094, 0.39638435632083235, 0.38967224939233275]","[0.6205331216585412, 0.6072957441073988, 0.5678857446016043, 0.6251334914962018, 0.6058027835016542]","[18.30166335818923, 18.495502788535273, 18.681876889123465, 17.099980926946746, 18.854078746690433]",COMPLETE
51,11.699453023604935,30.0,0.5,2,4,800,"[11.534236638297452, 11.594350630356695, 11.81672070208867, 11.554705374482992, 11.997251772798867]","[0.3907436386233446, 0.39742521650446033, 0.43644980406470557, 0.394648056902743, 0.38671196703314764]","[0.6219606774670701, 0.6081938223750019, 0.5687049965295419, 0.6238493456348734, 0.6085170518277193]","[18.26720545713219, 18.47434193231238, 18.664158861223257, 17.129244805898065, 18.78905618516348]",COMPLETE
52,11.694968003747967,30.0,0.5,1,4,800,,,,,PRUNED
53,11.698150454241249,20.0,0.5,2,3,800,"[11.525120704104028, 11.562889197986982, 11.825738189113437, 11.54704549749769, 12.029958682504105]","[0.39132225601026527, 0.39678332656789644, 0.43766711390902224, 0.39445209798943104, 0.3870793079624448]","[0.6236922695479831, 0.6099447984772737, 0.5662200179506875, 0.6243065143038211, 0.609405007733449]","[18.22532138435521, 18.433014925628196, 18.717849977244217, 17.11883230918384, 18.767735557096362]",COMPLETE
54,11.707879228318717,20.0,0.5,3,2,800,"[11.54967129981152, 11.556103459981397, 11.831628117668703, 11.547056733534719, 12.054936530597248]","[0.39132508648995823, 0.3969039819454394, 0.43644899162103235, 0.3945594753112869, 0.38823246083872665]","[0.6211596644339495, 0.6089169493783475, 0.5678159544383388, 0.6243759938685808, 0.6065394420205639]","[18.28654805727989, 18.457285711611274, 18.683385469992977, 17.117249284644164, 18.836453669684957]",COMPLETE
55,11.732497783514791,20.0,0.5,4,3,300,"[11.576603906051925, 11.610018990685228, 11.8211113563555, 11.597976815739584, 12.056777848741715]","[0.3931724816394942, 0.39904018701807475, 0.4352136531522771, 0.3962437681914147, 0.3891065941701137]","[0.6193222317233832, 0.6077718219181872, 0.5704802079689124, 0.6227178727488389, 0.6051767208532879]","[18.330840672512277, 18.484288282143748, 18.6257083898531, 17.15498811225756, 18.869044797939182]",COMPLETE
56,11.680588454919656,20.0,0.5,5,4,800,,,,,PRUNED
57,11.66471793884219,20.0,sqrt,1,2,800,,,,,PRUNED
58,11.789835947507108,10.0,0.5,2,4,800,,,,,PRUNED
59,11.707879228318717,20.0,0.5,3,3,800,"[11.54967129981152, 11.556103459981399, 11.831628117668703, 11.547056733534719, 12.054936530597248]","[0.39132508648995823, 0.3969039819454394, 0.43644899162103235, 0.3945594753112868, 0.38823246083872665]","[0.6211596644339495, 0.6089169493783475, 0.5678159544383388, 0.6243759938685808, 0.6065394420205639]","[18.28654805727989, 18.457285711611274, 18.683385469992977, 17.117249284644164, 18.836453669684957]",COMPLETE
60,12.185855191255614,30.0,log2,7,18,500,,,,,PRUNED
61,11.706185566877057,30.0,0.5,2,5,800,"[11.534881810222489, 11.562449428129794, 11.836111797922518, 11.56200202209981, 12.035482776010673]","[0.39034952397646633, 0.3968703176029114, 0.4372405888045632, 0.3952902575596529, 0.38745301923009895]","[0.6218126461058515, 0.6096546901491222, 0.566385322639336, 0.6242679587189465, 0.6062950850407705]","[18.270781612392575, 18.439868541682063, 18.71428314229784, 17.11971069766304, 18.84230191090893]",COMPLETE
62,11.730018984096468,30.0,0.5,4,2,800,"[11.558302207885356, 11.620263880214472, 11.838119243449222, 11.58157801934348, 12.051831569589806]","[0.3926026232122053, 0.39926646373773444, 0.4364276534831409, 0.3963843563208324, 0.38967224939233264]","[0.6205331216585412, 0.607295744107399, 0.5678857446016043, 0.6251334914962018, 0.6058027835016542]","[18.30166335818923, 18.49550278853527, 18.681876889123465, 17.099980926946746, 18.854078746690433]",COMPLETE
63,11.705574908525392,30.0,0.5,1,3,800,,,,,PRUNED
64,11.703221435297488,30.0,0.5,3,4,800,"[11.529111427918503, 11.58655943060001, 11.814779391647662, 11.560357411583318, 12.025299514737945]","[0.391913642528305, 0.3977027394025938, 0.4365892669555264, 0.39453376946891916, 0.38831619612356205]","[0.6219661062765154, 0.6071688756075597, 0.5681363347326179, 0.623655682627911, 0.6064039052795422]","[18.267074294145107, 18.498490160292725, 18.676459140421183, 17.13365377627379, 18.839697720029964]",COMPLETE
65,11.703221435297488,30.0,0.5,3,4,800,"[11.529111427918501, 11.586559430600008, 11.814779391647662, 11.560357411583318, 12.025299514737943]","[0.391913642528305, 0.3977027394025938, 0.4365892669555264, 0.39453376946891916, 0.38831619612356205]","[0.6219661062765154, 0.6071688756075596, 0.568136334732618, 0.623655682627911, 0.6064039052795422]","[18.267074294145107, 18.498490160292725, 18.67645914042118, 17.13365377627379, 18.839697720029964]",COMPLETE
66,11.783069590404136,10.0,0.5,3,3,800,,,,,PRUNED
67,12.082407217638899,30.0,0.5,16,4,800,,,,,PRUNED
68,11.904431152595961,20.0,log2,5,2,300,,,,,PRUNED
69,11.730018984096468,30.0,0.5,4,6,800,"[11.558302207885356, 11.620263880214472, 11.838119243449222, 11.58157801934348, 12.051831569589806]","[0.3926026232122053, 0.39926646373773444, 0.4364276534831409, 0.39638435632083235, 0.38967224939233264]","[0.6205331216585412, 0.607295744107399, 0.5678857446016043, 0.6251334914962018, 0.6058027835016542]","[18.30166335818923, 18.49550278853527, 18.68187688912347, 17.099980926946746, 18.854078746690433]",COMPLETE
70,11.658605307377957,30.0,0.5,6,3,800,,,,,PRUNED
71,11.703221435297488,30.0,0.5,3,4,800,"[11.529111427918503, 11.58655943060001, 11.814779391647662, 11.560357411583318, 12.025299514737945]","[0.391913642528305, 0.3977027394025938, 0.4365892669555264, 0.39453376946891916, 0.38831619612356205]","[0.6219661062765154, 0.6071688756075597, 0.568136334732618, 0.6236556826279112, 0.6064039052795422]","[18.267074294145107, 18.49849016029272, 18.67645914042118, 17.13365377627379, 18.839697720029964]",COMPLETE
72,11.699453023604935,30.0,0.5,2,4,800,"[11.534236638297452, 11.594350630356695, 11.81672070208867, 11.554705374482992, 11.997251772798867]","[0.39074363862334466, 0.39742521650446033, 0.43644980406470557, 0.394648056902743, 0.38671196703314764]","[0.6219606774670701, 0.6081938223750019, 0.5687049965295419, 0.6238493456348734, 0.6085170518277193]","[18.26720545713219, 18.47434193231238, 18.664158861223257, 17.129244805898065, 18.78905618516348]",COMPLETE
73,11.706185566877057,30.0,0.5,2,5,800,"[11.534881810222489, 11.562449428129794, 11.836111797922518, 11.56200202209981, 12.035482776010673]","[0.39034952397646633, 0.3968703176029114, 0.4372405888045632, 0.39529025755965297, 0.38745301923009895]","[0.6218126461058515, 0.6096546901491222, 0.566385322639336, 0.6242679587189464, 0.6062950850407705]","[18.270781612392575, 18.439868541682063, 18.71428314229784, 17.119710697663045, 18.84230191090893]",COMPLETE
74,11.70557490852539,30.0,0.5,1,3,800,,,,,PRUNED
