number,value,params_max_depth,params_max_features,params_min_samples_leaf,params_min_samples_split,params_n_estimators,user_attrs_mae_per_fold,user_attrs_mape_per_fold,user_attrs_r2_per_fold,user_attrs_rmse_per_fold,state
75,11.699453023604935,30.0,0.5,2,2,800,"[11.534236638297452, 11.594350630356693, 11.81672070208867, 11.554705374482994, 11.997251772798867]","[0.39074363862334466, 0.39742521650446033, 0.43644980406470557, 0.39464805690274307, 0.38671196703314764]","[0.6219606774670701, 0.6081938223750019, 0.5687049965295419, 0.6238493456348734, 0.6085170518277193]","[18.26720545713219, 18.47434193231238, 18.664158861223257, 17.129244805898065, 18.78905618516348]",COMPLETE
76,11.682285158245119,30.0,sqrt,2,2,800,,,,,PRUNED
77,11.699447439245825,30.0,0.5,2,2,500,"[11.515875663802237, 11.593622049812025, 11.834993827727969, 11.554098432100602, 11.99864722278629]","[0.39031309003783665, 0.3976160929577686, 0.4368448800063506, 0.3941053310630909, 0.38711679087144835]","[0.6220595814728496, 0.6088782073656281, 0.5686492949025019, 0.6240078597706202, 0.6087919654909162]","[18.264815734859006, 18.45819990961624, 18.66536405771628, 17.12563519692615, 18.78245784488553]",COMPLETE
78,11.839033230261634,10.0,0.5,1,2,500,,,,,PRUNED
79,11.699447439245825,30.0,0.5,2,2,500,"[11.515875663802237, 11.593622049812025, 11.834993827727969, 11.5540984321006, 11.998647222786289]","[0.39031309003783665, 0.3976160929577686, 0.4368448800063506, 0.3941053310630909, 0.38711679087144835]","[0.6220595814728496, 0.6088782073656281, 0.5686492949025019, 0.6240078597706205, 0.6087919654909162]","[18.264815734859006, 18.45819990961624, 18.66536405771628, 17.12563519692615, 18.78245784488553]",COMPLETE
80,11.700521161554951,20.0,0.5,1,5,500,,,,,PRUNED
81,11.699447439245825,30.0,0.5,2,2,500,"[11.515875663802237, 11.593622049812025, 11.834993827727969, 11.5540984321006, 11.99864722278629]","[0.39031309003783665, 0.39761609295776856, 0.4368448800063506, 0.3941053310630909, 0.38711679087144835]","[0.6220595814728496, 0.6088782073656281, 0.5686492949025019, 0.6240078597706202, 0.6087919654909162]","[18.264815734859006, 18.45819990961624, 18.66536405771628, 17.12563519692615, 18.78245784488553]",COMPLETE
82,11.699447439245825,30.0,0.5,2,2,500,"[11.515875663802237, 11.593622049812025, 11.834993827727969, 11.554098432100599, 11.99864722278629]","[0.39031309003783665, 0.39761609295776856, 0.4368448800063506, 0.3941053310630909, 0.3871167908714484]","[0.6220595814728496, 0.6088782073656281, 0.5686492949025019, 0.6240078597706202, 0.6087919654909162]","[18.26481573485901, 18.45819990961624, 18.66536405771628, 17.12563519692615, 18.78245784488553]",COMPLETE
83,11.654790949778684,30.0,0.5,4,2,500,,,,,PRUNED
84,11.699447439245825,30.0,0.5,2,3,500,"[11.515875663802237, 11.593622049812025, 11.834993827727969, 11.5540984321006, 11.998647222786289]","[0.39031309003783665, 0.39761609295776856, 0.4368448800063506, 0.3941053310630909, 0.38711679087144835]","[0.6220595814728496, 0.608878207365628, 0.5686492949025019, 0.6240078597706202, 0.6087919654909162]","[18.264815734859006, 18.45819990961624, 18.66536405771628, 17.12563519692615, 18.78245784488553]",COMPLETE
85,11.644110457028546,30.0,0.5,1,3,500,,,,,PRUNED
86,11.748188245504195,30.0,log2,2,2,500,,,,,PRUNED
87,11.654790949778684,30.0,0.5,4,3,500,,,,,PRUNED
88,11.693648590601962,30.0,0.5,3,2,500,"[11.513823677316516, 11.575514749209853, 11.8226404258344, 11.540424550601106, 12.015839550047929]","[0.3909838560571175, 0.3968105952988642, 0.4371406515995445, 0.3936755663336321, 0.38805492137816067]","[0.6215568987284444, 0.6077848594942851, 0.5678647237755649, 0.6245825386919259, 0.6069563601634272]","[18.276958332378, 18.483981072805907, 18.682331287125173, 17.112542496313075, 18.82647129586031]",COMPLETE
89,11.68714868594628,30.0,0.5,5,2,500,,,,,PRUNED
90,11.739154152215033,30.0,1.0,3,2,500,,,,,PRUNED
91,11.644110457028546,30.0,0.5,1,3,500,,,,,PRUNED
92,11.699447439245825,30.0,0.5,2,3,500,"[11.515875663802237, 11.593622049812025, 11.834993827727969, 11.5540984321006, 11.998647222786293]","[0.39031309003783665, 0.39761609295776856, 0.4368448800063506, 0.3941053310630909, 0.38711679087144835]","[0.6220595814728496, 0.6088782073656281, 0.5686492949025019, 0.6240078597706202, 0.6087919654909162]","[18.264815734859006, 18.45819990961624, 18.66536405771628, 17.12563519692615, 18.78245784488553]",COMPLETE
93,11.693648590601962,30.0,0.5,3,2,500,"[11.513823677316516, 11.575514749209853, 11.8226404258344, 11.540424550601106, 12.015839550047929]","[0.3909838560571175, 0.3968105952988642, 0.43714065159954446, 0.3936755663336321, 0.38805492137816067]","[0.6215568987284443, 0.6077848594942851, 0.5678647237755649, 0.6245825386919259, 0.6069563601634272]","[18.276958332378, 18.483981072805907, 18.682331287125173, 17.112542496313075, 18.82647129586031]",COMPLETE
94,11.693648590601962,30.0,0.5,3,2,500,"[11.513823677316516, 11.575514749209853, 11.8226404258344, 11.540424550601106, 12.015839550047929]","[0.3909838560571175, 0.3968105952988642, 0.4371406515995445, 0.3936755663336321, 0.38805492137816067]","[0.6215568987284446, 0.6077848594942851, 0.567864723775565, 0.6245825386919259, 0.6069563601634272]","[18.276958332378, 18.483981072805907, 18.682331287125173, 17.112542496313075, 18.82647129586031]",COMPLETE
95,11.693648590601962,30.0,0.5,3,2,500,"[11.513823677316516, 11.575514749209853, 11.8226404258344, 11.540424550601106, 12.015839550047929]","[0.39098385605711744, 0.3968105952988642, 0.43714065159954446, 0.3936755663336321, 0.38805492137816067]","[0.6215568987284443, 0.6077848594942851, 0.5678647237755647, 0.6245825386919259, 0.6069563601634272]","[18.276958332378, 18.483981072805907, 18.682331287125177, 17.112542496313075, 18.82647129586031]",COMPLETE
96,11.651021825962147,20.0,0.5,4,2,500,,,,,PRUNED
97,11.693648590601962,30.0,0.5,3,2,500,"[11.513823677316516, 11.575514749209853, 11.8226404258344, 11.540424550601106, 12.015839550047929]","[0.3909838560571175, 0.3968105952988642, 0.43714065159954446, 0.39367556633363215, 0.38805492137816067]","[0.6215568987284444, 0.6077848594942851, 0.5678647237755649, 0.6245825386919259, 0.6069563601634271]","[18.276958332378, 18.483981072805907, 18.682331287125173, 17.112542496313075, 18.82647129586031]",COMPLETE
98,11.659012892127482,30.0,sqrt,3,2,500,,,,,PRUNED
99,11.843736452739336,10.0,0.5,5,2,500,,,,,PRUNED
