[I 2026-06-28 14:06:10,406] Trial 16 finished with value: 12.00955619528849 and parameters: {'n_layers': 2, 'n_trees': 128, 'tree_depth': 6, 'choice_function': 'sparsemax', 'lr': 0.004064625140174765, 'weight_decay': 1.2348651250385347e-05}. Best is trial 2 with value: 11.961620532345943.
/home/aubjpm001/.conda/envs/portsdfl-predict/lib/python3.11/site-packages/pytorch_tabular/models/common/layers/soft_trees.py:138: UserWarning: Data-aware initialization is performed on less than 1000 data points. This may cause instability.To avoid potential problems, run this model on a data batch with at least 1000 data samples.You can do so manually before training. Use with torch.no_grad() for memory efficiency.
  warn(
/home/aubjpm001/.conda/envs/portsdfl-predict/lib/python3.11/site-packages/pytorch_tabular/models/common/layers/soft_trees.py:138: UserWarning: Data-aware initialization is performed on less than 1000 data points. This may cause instability.To avoid potential problems, run this model on a data batch with at least 1000 data samples.You can do so manually before training. Use with torch.no_grad() for memory efficiency.
  warn(
/home/aubjpm001/.conda/envs/portsdfl-predict/lib/python3.11/site-packages/pytorch_tabular/models/common/layers/soft_trees.py:138: UserWarning: Data-aware initialization is performed on less than 1000 data points. This may cause instability.To avoid potential problems, run this model on a data batch with at least 1000 data samples.You can do so manually before training. Use with torch.no_grad() for memory efficiency.
  warn(
/home/aubjpm001/.conda/envs/portsdfl-predict/lib/python3.11/site-packages/pytorch_tabular/models/common/layers/soft_trees.py:138: UserWarning: Data-aware initialization is performed on less than 1000 data points. This may cause instability.To avoid potential problems, run this model on a data batch with at least 1000 data samples.You can do so manually before training. Use with torch.no_grad() for memory efficiency.
  warn(
/home/aubjpm001/.conda/envs/portsdfl-predict/lib/python3.11/site-packages/pytorch_tabular/models/common/layers/soft_trees.py:138: UserWarning: Data-aware initialization is performed on less than 1000 data points. This may cause instability.To avoid potential problems, run this model on a data batch with at least 1000 data samples.You can do so manually before training. Use with torch.no_grad() for memory efficiency.
  warn(
[I 2026-06-28 14:09:03,286] Trial 17 finished with value: 12.045305236784072 and parameters: {'n_layers': 4, 'n_trees': 256, 'tree_depth': 7, 'choice_function': 'entmax15', 'lr': 0.002106397978144513, 'weight_decay': 2.7662829820544362e-06}. Best is trial 2 with value: 11.961620532345943.
/home/aubjpm001/.conda/envs/portsdfl-predict/lib/python3.11/site-packages/pytorch_tabular/models/common/layers/soft_trees.py:138: UserWarning: Data-aware initialization is performed on less than 1000 data points. This may cause instability.To avoid potential problems, run this model on a data batch with at least 1000 data samples.You can do so manually before training. Use with torch.no_grad() for memory efficiency.
  warn(
/home/aubjpm001/.conda/envs/portsdfl-predict/lib/python3.11/site-packages/pytorch_tabular/models/common/layers/soft_trees.py:138: UserWarning: Data-aware initialization is performed on less than 1000 data points. This may cause instability.To avoid potential problems, run this model on a data batch with at least 1000 data samples.You can do so manually before training. Use with torch.no_grad() for memory efficiency.
  warn(
/home/aubjpm001/.conda/envs/portsdfl-predict/lib/python3.11/site-packages/pytorch_tabular/models/common/layers/soft_trees.py:138: UserWarning: Data-aware initialization is performed on less than 1000 data points. This may cause instability.To avoid potential problems, run this model on a data batch with at least 1000 data samples.You can do so manually before training. Use with torch.no_grad() for memory efficiency.
  warn(
/home/aubjpm001/.conda/envs/portsdfl-predict/lib/python3.11/site-packages/pytorch_tabular/models/common/layers/soft_trees.py:138: UserWarning: Data-aware initialization is performed on less than 1000 data points. This may cause instability.To avoid potential problems, run this model on a data batch with at least 1000 data samples.You can do so manually before training. Use with torch.no_grad() for memory efficiency.
  warn(
/home/aubjpm001/.conda/envs/portsdfl-predict/lib/python3.11/site-packages/pytorch_tabular/models/common/layers/soft_trees.py:138: UserWarning: Data-aware initialization is performed on less than 1000 data points. This may cause instability.To avoid potential problems, run this model on a data batch with at least 1000 data samples.You can do so manually before training. Use with torch.no_grad() for memory efficiency.
  warn(
[I 2026-06-28 14:09:32,442] Trial 18 finished with value: 12.083564379091564 and parameters: {'n_layers': 2, 'n_trees': 128, 'tree_depth': 6, 'choice_function': 'sparsemax', 'lr': 0.009949133229236502, 'weight_decay': 0.0008546718436668516}. Best is trial 2 with value: 11.961620532345943.
/home/aubjpm001/.conda/envs/portsdfl-predict/lib/python3.11/site-packages/pytorch_tabular/models/common/layers/soft_trees.py:138: UserWarning: Data-aware initialization is performed on less than 1000 data points. This may cause instability.To avoid potential problems, run this model on a data batch with at least 1000 data samples.You can do so manually before training. Use with torch.no_grad() for memory efficiency.
  warn(
/home/aubjpm001/.conda/envs/portsdfl-predict/lib/python3.11/site-packages/pytorch_tabular/models/common/layers/soft_trees.py:138: UserWarning: Data-aware initialization is performed on less than 1000 data points. This may cause instability.To avoid potential problems, run this model on a data batch with at least 1000 data samples.You can do so manually before training. Use with torch.no_grad() for memory efficiency.
  warn(
/home/aubjpm001/.conda/envs/portsdfl-predict/lib/python3.11/site-packages/pytorch_tabular/models/common/layers/soft_trees.py:138: UserWarning: Data-aware initialization is performed on less than 1000 data points. This may cause instability.To avoid potential problems, run this model on a data batch with at least 1000 data samples.You can do so manually before training. Use with torch.no_grad() for memory efficiency.
  warn(
/home/aubjpm001/.conda/envs/portsdfl-predict/lib/python3.11/site-packages/pytorch_tabular/models/common/layers/soft_trees.py:138: UserWarning: Data-aware initialization is performed on less than 1000 data points. This may cause instability.To avoid potential problems, run this model on a data batch with at least 1000 data samples.You can do so manually before training. Use with torch.no_grad() for memory efficiency.
  warn(
/home/aubjpm001/.conda/envs/portsdfl-predict/lib/python3.11/site-packages/pytorch_tabular/models/common/layers/soft_trees.py:138: UserWarning: Data-aware initialization is performed on less than 1000 data points. This may cause instability.To avoid potential problems, run this model on a data batch with at least 1000 data samples.You can do so manually before training. Use with torch.no_grad() for memory efficiency.
  warn(
[I 2026-06-28 14:13:13,389] Trial 19 finished with value: 12.07346741393724 and parameters: {'n_layers': 6, 'n_trees': 512, 'tree_depth': 6, 'choice_function': 'entmax15', 'lr': 0.004685070722983621, 'weight_decay': 1.6690666002492872e-05}. Best is trial 2 with value: 11.961620532345943.
/home/aubjpm001/.conda/envs/portsdfl-predict/lib/python3.11/site-packages/pytorch_tabular/models/common/layers/soft_trees.py:138: UserWarning: Data-aware initialization is performed on less than 1000 data points. This may cause instability.To avoid potential problems, run this model on a data batch with at least 1000 data samples.You can do so manually before training. Use with torch.no_grad() for memory efficiency.
  warn(
/home/aubjpm001/.conda/envs/portsdfl-predict/lib/python3.11/site-packages/pytorch_tabular/models/common/layers/soft_trees.py:138: UserWarning: Data-aware initialization is performed on less than 1000 data points. This may cause instability.To avoid potential problems, run this model on a data batch with at least 1000 data samples.You can do so manually before training. Use with torch.no_grad() for memory efficiency.
  warn(
/home/aubjpm001/.conda/envs/portsdfl-predict/lib/python3.11/site-packages/pytorch_tabular/models/common/layers/soft_trees.py:138: UserWarning: Data-aware initialization is performed on less than 1000 data points. This may cause instability.To avoid potential problems, run this model on a data batch with at least 1000 data samples.You can do so manually before training. Use with torch.no_grad() for memory efficiency.
  warn(
/home/aubjpm001/.conda/envs/portsdfl-predict/lib/python3.11/site-packages/pytorch_tabular/models/common/layers/soft_trees.py:138: UserWarning: Data-aware initialization is performed on less than 1000 data points. This may cause instability.To avoid potential problems, run this model on a data batch with at least 1000 data samples.You can do so manually before training. Use with torch.no_grad() for memory efficiency.
  warn(
/home/aubjpm001/.conda/envs/portsdfl-predict/lib/python3.11/site-packages/pytorch_tabular/models/common/layers/soft_trees.py:138: UserWarning: Data-aware initialization is performed on less than 1000 data points. This may cause instability.To avoid potential problems, run this model on a data batch with at least 1000 data samples.You can do so manually before training. Use with torch.no_grad() for memory efficiency.
  warn(
[I 2026-06-28 14:17:04,139] Trial 20 finished with value: 12.17696042304084 and parameters: {'n_layers': 4, 'n_trees': 256, 'tree_depth': 7, 'choice_function': 'entmax15', 'lr': 0.000745439397478521, 'weight_decay': 8.540123187128035e-05}. Best is trial 2 with value: 11.961620532345943.
/home/aubjpm001/.conda/envs/portsdfl-predict/lib/python3.11/site-packages/pytorch_tabular/models/common/layers/soft_trees.py:138: UserWarning: Data-aware initialization is performed on less than 1000 data points. This may cause instability.To avoid potential problems, run this model on a data batch with at least 1000 data samples.You can do so manually before training. Use with torch.no_grad() for memory efficiency.
  warn(
/home/aubjpm001/.conda/envs/portsdfl-predict/lib/python3.11/site-packages/pytorch_tabular/models/common/layers/soft_trees.py:138: UserWarning: Data-aware initialization is performed on less than 1000 data points. This may cause instability.To avoid potential problems, run this model on a data batch with at least 1000 data samples.You can do so manually before training. Use with torch.no_grad() for memory efficiency.
  warn(
/home/aubjpm001/.conda/envs/portsdfl-predict/lib/python3.11/site-packages/pytorch_tabular/models/common/layers/soft_trees.py:138: UserWarning: Data-aware initialization is performed on less than 1000 data points. This may cause instability.To avoid potential problems, run this model on a data batch with at least 1000 data samples.You can do so manually before training. Use with torch.no_grad() for memory efficiency.
  warn(
/home/aubjpm001/.conda/envs/portsdfl-predict/lib/python3.11/site-packages/pytorch_tabular/models/common/layers/soft_trees.py:138: UserWarning: Data-aware initialization is performed on less than 1000 data points. This may cause instability.To avoid potential problems, run this model on a data batch with at least 1000 data samples.You can do so manually before training. Use with torch.no_grad() for memory efficiency.
  warn(
/home/aubjpm001/.conda/envs/portsdfl-predict/lib/python3.11/site-packages/pytorch_tabular/models/common/layers/soft_trees.py:138: UserWarning: Data-aware initialization is performed on less than 1000 data points. This may cause instability.To avoid potential problems, run this model on a data batch with at least 1000 data samples.You can do so manually before training. Use with torch.no_grad() for memory efficiency.
  warn(
[I 2026-06-28 14:17:45,513] Trial 21 finished with value: 11.953939110055781 and parameters: {'n_layers': 2, 'n_trees': 128, 'tree_depth': 6, 'choice_function': 'sparsemax', 'lr': 0.003538687566135273, 'weight_decay': 8.539461982593093e-06}. Best is trial 21 with value: 11.953939110055781.
/home/aubjpm001/.conda/envs/portsdfl-predict/lib/python3.11/site-packages/pytorch_tabular/models/common/layers/soft_trees.py:138: UserWarning: Data-aware initialization is performed on less than 1000 data points. This may cause instability.To avoid potential problems, run this model on a data batch with at least 1000 data samples.You can do so manually before training. Use with torch.no_grad() for memory efficiency.
  warn(
/home/aubjpm001/.conda/envs/portsdfl-predict/lib/python3.11/site-packages/pytorch_tabular/models/common/layers/soft_trees.py:138: UserWarning: Data-aware initialization is performed on less than 1000 data points. This may cause instability.To avoid potential problems, run this model on a data batch with at least 1000 data samples.You can do so manually before training. Use with torch.no_grad() for memory efficiency.
  warn(
/home/aubjpm001/.conda/envs/portsdfl-predict/lib/python3.11/site-packages/pytorch_tabular/models/common/layers/soft_trees.py:138: UserWarning: Data-aware initialization is performed on less than 1000 data points. This may cause instability.To avoid potential problems, run this model on a data batch with at least 1000 data samples.You can do so manually before training. Use with torch.no_grad() for memory efficiency.
  warn(
/home/aubjpm001/.conda/envs/portsdfl-predict/lib/python3.11/site-packages/pytorch_tabular/models/common/layers/soft_trees.py:138: UserWarning: Data-aware initialization is performed on less than 1000 data points. This may cause instability.To avoid potential problems, run this model on a data batch with at least 1000 data samples.You can do so manually before training. Use with torch.no_grad() for memory efficiency.
  warn(
/home/aubjpm001/.conda/envs/portsdfl-predict/lib/python3.11/site-packages/pytorch_tabular/models/common/layers/soft_trees.py:138: UserWarning: Data-aware initialization is performed on less than 1000 data points. This may cause instability.To avoid potential problems, run this model on a data batch with at least 1000 data samples.You can do so manually before training. Use with torch.no_grad() for memory efficiency.
  warn(
[I 2026-06-28 14:18:28,485] Trial 22 finished with value: 11.899724346528089 and parameters: {'n_layers': 2, 'n_trees': 128, 'tree_depth': 6, 'choice_function': 'sparsemax', 'lr': 0.0029704666855166744, 'weight_decay': 6.639727368541646e-06}. Best is trial 22 with value: 11.899724346528089.
/home/aubjpm001/.conda/envs/portsdfl-predict/lib/python3.11/site-packages/pytorch_tabular/models/common/layers/soft_trees.py:138: UserWarning: Data-aware initialization is performed on less than 1000 data points. This may cause instability.To avoid potential problems, run this model on a data batch with at least 1000 data samples.You can do so manually before training. Use with torch.no_grad() for memory efficiency.
  warn(
/home/aubjpm001/.conda/envs/portsdfl-predict/lib/python3.11/site-packages/pytorch_tabular/models/common/layers/soft_trees.py:138: UserWarning: Data-aware initialization is performed on less than 1000 data points. This may cause instability.To avoid potential problems, run this model on a data batch with at least 1000 data samples.You can do so manually before training. Use with torch.no_grad() for memory efficiency.
  warn(
/home/aubjpm001/.conda/envs/portsdfl-predict/lib/python3.11/site-packages/pytorch_tabular/models/common/layers/soft_trees.py:138: UserWarning: Data-aware initialization is performed on less than 1000 data points. This may cause instability.To avoid potential problems, run this model on a data batch with at least 1000 data samples.You can do so manually before training. Use with torch.no_grad() for memory efficiency.
  warn(
/home/aubjpm001/.conda/envs/portsdfl-predict/lib/python3.11/site-packages/pytorch_tabular/models/common/layers/soft_trees.py:138: UserWarning: Data-aware initialization is performed on less than 1000 data points. This may cause instability.To avoid potential problems, run this model on a data batch with at least 1000 data samples.You can do so manually before training. Use with torch.no_grad() for memory efficiency.
  warn(
/home/aubjpm001/.conda/envs/portsdfl-predict/lib/python3.11/site-packages/pytorch_tabular/models/common/layers/soft_trees.py:138: UserWarning: Data-aware initialization is performed on less than 1000 data points. This may cause instability.To avoid potential problems, run this model on a data batch with at least 1000 data samples.You can do so manually before training. Use with torch.no_grad() for memory efficiency.
  warn(
[I 2026-06-28 14:19:15,009] Trial 23 finished with value: 11.950667164439949 and parameters: {'n_layers': 2, 'n_trees': 128, 'tree_depth': 6, 'choice_function': 'sparsemax', 'lr': 0.0025526156891833153, 'weight_decay': 6.656569667569343e-06}. Best is trial 22 with value: 11.899724346528089.
/home/aubjpm001/.conda/envs/portsdfl-predict/lib/python3.11/site-packages/pytorch_tabular/models/common/layers/soft_trees.py:138: UserWarning: Data-aware initialization is performed on less than 1000 data points. This may cause instability.To avoid potential problems, run this model on a data batch with at least 1000 data samples.You can do so manually before training. Use with torch.no_grad() for memory efficiency.
  warn(
/home/aubjpm001/.conda/envs/portsdfl-predict/lib/python3.11/site-packages/pytorch_tabular/models/common/layers/soft_trees.py:138: UserWarning: Data-aware initialization is performed on less than 1000 data points. This may cause instability.To avoid potential problems, run this model on a data batch with at least 1000 data samples.You can do so manually before training. Use with torch.no_grad() for memory efficiency.
  warn(
/home/aubjpm001/.conda/envs/portsdfl-predict/lib/python3.11/site-packages/pytorch_tabular/models/common/layers/soft_trees.py:138: UserWarning: Data-aware initialization is performed on less than 1000 data points. This may cause instability.To avoid potential problems, run this model on a data batch with at least 1000 data samples.You can do so manually before training. Use with torch.no_grad() for memory efficiency.
  warn(
/home/aubjpm001/.conda/envs/portsdfl-predict/lib/python3.11/site-packages/pytorch_tabular/models/common/layers/soft_trees.py:138: UserWarning: Data-aware initialization is performed on less than 1000 data points. This may cause instability.To avoid potential problems, run this model on a data batch with at least 1000 data samples.You can do so manually before training. Use with torch.no_grad() for memory efficiency.
  warn(
/home/aubjpm001/.conda/envs/portsdfl-predict/lib/python3.11/site-packages/pytorch_tabular/models/common/layers/soft_trees.py:138: UserWarning: Data-aware initialization is performed on less than 1000 data points. This may cause instability.To avoid potential problems, run this model on a data batch with at least 1000 data samples.You can do so manually before training. Use with torch.no_grad() for memory efficiency.
  warn(
[I 2026-06-28 14:20:05,850] Trial 24 finished with value: 11.954058334384602 and parameters: {'n_layers': 2, 'n_trees': 128, 'tree_depth': 6, 'choice_function': 'sparsemax', 'lr': 0.002355920914050554, 'weight_decay': 7.1298527487291914e-06}. Best is trial 22 with value: 11.899724346528089.
/home/aubjpm001/.conda/envs/portsdfl-predict/lib/python3.11/site-packages/pytorch_tabular/models/common/layers/soft_trees.py:138: UserWarning: Data-aware initialization is performed on less than 1000 data points. This may cause instability.To avoid potential problems, run this model on a data batch with at least 1000 data samples.You can do so manually before training. Use with torch.no_grad() for memory efficiency.
  warn(
/home/aubjpm001/.conda/envs/portsdfl-predict/lib/python3.11/site-packages/pytorch_tabular/models/common/layers/soft_trees.py:138: UserWarning: Data-aware initialization is performed on less than 1000 data points. This may cause instability.To avoid potential problems, run this model on a data batch with at least 1000 data samples.You can do so manually before training. Use with torch.no_grad() for memory efficiency.
  warn(
/home/aubjpm001/.conda/envs/portsdfl-predict/lib/python3.11/site-packages/pytorch_tabular/models/common/layers/soft_trees.py:138: UserWarning: Data-aware initialization is performed on less than 1000 data points. This may cause instability.To avoid potential problems, run this model on a data batch with at least 1000 data samples.You can do so manually before training. Use with torch.no_grad() for memory efficiency.
  warn(
/home/aubjpm001/.conda/envs/portsdfl-predict/lib/python3.11/site-packages/pytorch_tabular/models/common/layers/soft_trees.py:138: UserWarning: Data-aware initialization is performed on less than 1000 data points. This may cause instability.To avoid potential problems, run this model on a data batch with at least 1000 data samples.You can do so manually before training. Use with torch.no_grad() for memory efficiency.
  warn(
/home/aubjpm001/.conda/envs/portsdfl-predict/lib/python3.11/site-packages/pytorch_tabular/models/common/layers/soft_trees.py:138: UserWarning: Data-aware initialization is performed on less than 1000 data points. This may cause instability.To avoid potential problems, run this model on a data batch with at least 1000 data samples.You can do so manually before training. Use with torch.no_grad() for memory efficiency.
  warn(
