[I 2026-06-28 14:31:11,895] Trial 34 finished with value: 11.954033154050201 and parameters: {'n_layers': 2, 'n_trees': 128, 'tree_depth': 6, 'choice_function': 'sparsemax', 'lr': 0.002866667567267502, 'weight_decay': 2.273886295366164e-05}. Best is trial 22 with value: 11.899724346528089.
/home/aubjpm001/.conda/envs/portsdfl-predict/lib/python3.11/site-packages/pytorch_tabular/models/common/layers/soft_trees.py:138: UserWarning: Data-aware initialization is performed on less than 1000 data points. This may cause instability.To avoid potential problems, run this model on a data batch with at least 1000 data samples.You can do so manually before training. Use with torch.no_grad() for memory efficiency.
  warn(
/home/aubjpm001/.conda/envs/portsdfl-predict/lib/python3.11/site-packages/pytorch_tabular/models/common/layers/soft_trees.py:138: UserWarning: Data-aware initialization is performed on less than 1000 data points. This may cause instability.To avoid potential problems, run this model on a data batch with at least 1000 data samples.You can do so manually before training. Use with torch.no_grad() for memory efficiency.
  warn(
/home/aubjpm001/.conda/envs/portsdfl-predict/lib/python3.11/site-packages/pytorch_tabular/models/common/layers/soft_trees.py:138: UserWarning: Data-aware initialization is performed on less than 1000 data points. This may cause instability.To avoid potential problems, run this model on a data batch with at least 1000 data samples.You can do so manually before training. Use with torch.no_grad() for memory efficiency.
  warn(
/home/aubjpm001/.conda/envs/portsdfl-predict/lib/python3.11/site-packages/pytorch_tabular/models/common/layers/soft_trees.py:138: UserWarning: Data-aware initialization is performed on less than 1000 data points. This may cause instability.To avoid potential problems, run this model on a data batch with at least 1000 data samples.You can do so manually before training. Use with torch.no_grad() for memory efficiency.
  warn(
/home/aubjpm001/.conda/envs/portsdfl-predict/lib/python3.11/site-packages/pytorch_tabular/models/common/layers/soft_trees.py:138: UserWarning: Data-aware initialization is performed on less than 1000 data points. This may cause instability.To avoid potential problems, run this model on a data batch with at least 1000 data samples.You can do so manually before training. Use with torch.no_grad() for memory efficiency.
  warn(
[I 2026-06-28 14:32:20,812] Trial 35 finished with value: 12.03516405671722 and parameters: {'n_layers': 2, 'n_trees': 128, 'tree_depth': 6, 'choice_function': 'sparsemax', 'lr': 0.001206382983310033, 'weight_decay': 3.473928004981185e-05}. Best is trial 22 with value: 11.899724346528089.
/home/aubjpm001/.conda/envs/portsdfl-predict/lib/python3.11/site-packages/pytorch_tabular/models/common/layers/soft_trees.py:138: UserWarning: Data-aware initialization is performed on less than 1000 data points. This may cause instability.To avoid potential problems, run this model on a data batch with at least 1000 data samples.You can do so manually before training. Use with torch.no_grad() for memory efficiency.
  warn(
/home/aubjpm001/.conda/envs/portsdfl-predict/lib/python3.11/site-packages/pytorch_tabular/models/common/layers/soft_trees.py:138: UserWarning: Data-aware initialization is performed on less than 1000 data points. This may cause instability.To avoid potential problems, run this model on a data batch with at least 1000 data samples.You can do so manually before training. Use with torch.no_grad() for memory efficiency.
  warn(
/home/aubjpm001/.conda/envs/portsdfl-predict/lib/python3.11/site-packages/pytorch_tabular/models/common/layers/soft_trees.py:138: UserWarning: Data-aware initialization is performed on less than 1000 data points. This may cause instability.To avoid potential problems, run this model on a data batch with at least 1000 data samples.You can do so manually before training. Use with torch.no_grad() for memory efficiency.
  warn(
/home/aubjpm001/.conda/envs/portsdfl-predict/lib/python3.11/site-packages/pytorch_tabular/models/common/layers/soft_trees.py:138: UserWarning: Data-aware initialization is performed on less than 1000 data points. This may cause instability.To avoid potential problems, run this model on a data batch with at least 1000 data samples.You can do so manually before training. Use with torch.no_grad() for memory efficiency.
  warn(
/home/aubjpm001/.conda/envs/portsdfl-predict/lib/python3.11/site-packages/pytorch_tabular/models/common/layers/soft_trees.py:138: UserWarning: Data-aware initialization is performed on less than 1000 data points. This may cause instability.To avoid potential problems, run this model on a data batch with at least 1000 data samples.You can do so manually before training. Use with torch.no_grad() for memory efficiency.
  warn(
[I 2026-06-28 14:33:34,480] Trial 36 finished with value: 11.940648044128743 and parameters: {'n_layers': 2, 'n_trees': 512, 'tree_depth': 6, 'choice_function': 'sparsemax', 'lr': 0.002137684901100004, 'weight_decay': 3.982095186467556e-06}. Best is trial 22 with value: 11.899724346528089.
/home/aubjpm001/.conda/envs/portsdfl-predict/lib/python3.11/site-packages/pytorch_tabular/models/common/layers/soft_trees.py:138: UserWarning: Data-aware initialization is performed on less than 1000 data points. This may cause instability.To avoid potential problems, run this model on a data batch with at least 1000 data samples.You can do so manually before training. Use with torch.no_grad() for memory efficiency.
  warn(
/home/aubjpm001/.conda/envs/portsdfl-predict/lib/python3.11/site-packages/pytorch_tabular/models/common/layers/soft_trees.py:138: UserWarning: Data-aware initialization is performed on less than 1000 data points. This may cause instability.To avoid potential problems, run this model on a data batch with at least 1000 data samples.You can do so manually before training. Use with torch.no_grad() for memory efficiency.
  warn(
/home/aubjpm001/.conda/envs/portsdfl-predict/lib/python3.11/site-packages/pytorch_tabular/models/common/layers/soft_trees.py:138: UserWarning: Data-aware initialization is performed on less than 1000 data points. This may cause instability.To avoid potential problems, run this model on a data batch with at least 1000 data samples.You can do so manually before training. Use with torch.no_grad() for memory efficiency.
  warn(
/home/aubjpm001/.conda/envs/portsdfl-predict/lib/python3.11/site-packages/pytorch_tabular/models/common/layers/soft_trees.py:138: UserWarning: Data-aware initialization is performed on less than 1000 data points. This may cause instability.To avoid potential problems, run this model on a data batch with at least 1000 data samples.You can do so manually before training. Use with torch.no_grad() for memory efficiency.
  warn(
/home/aubjpm001/.conda/envs/portsdfl-predict/lib/python3.11/site-packages/pytorch_tabular/models/common/layers/soft_trees.py:138: UserWarning: Data-aware initialization is performed on less than 1000 data points. This may cause instability.To avoid potential problems, run this model on a data batch with at least 1000 data samples.You can do so manually before training. Use with torch.no_grad() for memory efficiency.
  warn(
[I 2026-06-28 14:34:56,434] Trial 37 finished with value: 11.93410810727963 and parameters: {'n_layers': 2, 'n_trees': 512, 'tree_depth': 6, 'choice_function': 'sparsemax', 'lr': 0.0018406373315960785, 'weight_decay': 3.6191578497479342e-06}. Best is trial 22 with value: 11.899724346528089.
/home/aubjpm001/.conda/envs/portsdfl-predict/lib/python3.11/site-packages/pytorch_tabular/models/common/layers/soft_trees.py:138: UserWarning: Data-aware initialization is performed on less than 1000 data points. This may cause instability.To avoid potential problems, run this model on a data batch with at least 1000 data samples.You can do so manually before training. Use with torch.no_grad() for memory efficiency.
  warn(
/home/aubjpm001/.conda/envs/portsdfl-predict/lib/python3.11/site-packages/pytorch_tabular/models/common/layers/soft_trees.py:138: UserWarning: Data-aware initialization is performed on less than 1000 data points. This may cause instability.To avoid potential problems, run this model on a data batch with at least 1000 data samples.You can do so manually before training. Use with torch.no_grad() for memory efficiency.
  warn(
/home/aubjpm001/.conda/envs/portsdfl-predict/lib/python3.11/site-packages/pytorch_tabular/models/common/layers/soft_trees.py:138: UserWarning: Data-aware initialization is performed on less than 1000 data points. This may cause instability.To avoid potential problems, run this model on a data batch with at least 1000 data samples.You can do so manually before training. Use with torch.no_grad() for memory efficiency.
  warn(
/home/aubjpm001/.conda/envs/portsdfl-predict/lib/python3.11/site-packages/pytorch_tabular/models/common/layers/soft_trees.py:138: UserWarning: Data-aware initialization is performed on less than 1000 data points. This may cause instability.To avoid potential problems, run this model on a data batch with at least 1000 data samples.You can do so manually before training. Use with torch.no_grad() for memory efficiency.
  warn(
/home/aubjpm001/.conda/envs/portsdfl-predict/lib/python3.11/site-packages/pytorch_tabular/models/common/layers/soft_trees.py:138: UserWarning: Data-aware initialization is performed on less than 1000 data points. This may cause instability.To avoid potential problems, run this model on a data batch with at least 1000 data samples.You can do so manually before training. Use with torch.no_grad() for memory efficiency.
  warn(
[I 2026-06-28 14:37:30,469] Trial 38 finished with value: 12.013536778592167 and parameters: {'n_layers': 2, 'n_trees': 512, 'tree_depth': 6, 'choice_function': 'sparsemax', 'lr': 0.000583001258165132, 'weight_decay': 3.949615868700263e-06}. Best is trial 22 with value: 11.899724346528089.
/home/aubjpm001/.conda/envs/portsdfl-predict/lib/python3.11/site-packages/pytorch_tabular/models/common/layers/soft_trees.py:138: UserWarning: Data-aware initialization is performed on less than 1000 data points. This may cause instability.To avoid potential problems, run this model on a data batch with at least 1000 data samples.You can do so manually before training. Use with torch.no_grad() for memory efficiency.
  warn(
/home/aubjpm001/.conda/envs/portsdfl-predict/lib/python3.11/site-packages/pytorch_tabular/models/common/layers/soft_trees.py:138: UserWarning: Data-aware initialization is performed on less than 1000 data points. This may cause instability.To avoid potential problems, run this model on a data batch with at least 1000 data samples.You can do so manually before training. Use with torch.no_grad() for memory efficiency.
  warn(
/home/aubjpm001/.conda/envs/portsdfl-predict/lib/python3.11/site-packages/pytorch_tabular/models/common/layers/soft_trees.py:138: UserWarning: Data-aware initialization is performed on less than 1000 data points. This may cause instability.To avoid potential problems, run this model on a data batch with at least 1000 data samples.You can do so manually before training. Use with torch.no_grad() for memory efficiency.
  warn(
/home/aubjpm001/.conda/envs/portsdfl-predict/lib/python3.11/site-packages/pytorch_tabular/models/common/layers/soft_trees.py:138: UserWarning: Data-aware initialization is performed on less than 1000 data points. This may cause instability.To avoid potential problems, run this model on a data batch with at least 1000 data samples.You can do so manually before training. Use with torch.no_grad() for memory efficiency.
  warn(
/home/aubjpm001/.conda/envs/portsdfl-predict/lib/python3.11/site-packages/pytorch_tabular/models/common/layers/soft_trees.py:138: UserWarning: Data-aware initialization is performed on less than 1000 data points. This may cause instability.To avoid potential problems, run this model on a data batch with at least 1000 data samples.You can do so manually before training. Use with torch.no_grad() for memory efficiency.
  warn(
[I 2026-06-28 14:38:53,651] Trial 39 finished with value: 11.901517158700525 and parameters: {'n_layers': 2, 'n_trees': 512, 'tree_depth': 6, 'choice_function': 'sparsemax', 'lr': 0.001784231978189051, 'weight_decay': 1.8824503047576368e-06}. Best is trial 22 with value: 11.899724346528089.
2026-06-28 14:38:53,692 INFO [node] best trial #22  MAE=11.900h
/home/aubjpm001/.conda/envs/portsdfl-predict/lib/python3.11/site-packages/pytorch_tabular/models/common/layers/soft_trees.py:138: UserWarning: Data-aware initialization is performed on less than 1000 data points. This may cause instability.To avoid potential problems, run this model on a data batch with at least 1000 data samples.You can do so manually before training. Use with torch.no_grad() for memory efficiency.
  warn(
2026-06-28 14:39:01,843 INFO [node] fold 1/5  MAE=11.96h
/home/aubjpm001/.conda/envs/portsdfl-predict/lib/python3.11/site-packages/pytorch_tabular/models/common/layers/soft_trees.py:138: UserWarning: Data-aware initialization is performed on less than 1000 data points. This may cause instability.To avoid potential problems, run this model on a data batch with at least 1000 data samples.You can do so manually before training. Use with torch.no_grad() for memory efficiency.
  warn(
2026-06-28 14:39:09,674 INFO [node] fold 2/5  MAE=11.88h
/home/aubjpm001/.conda/envs/portsdfl-predict/lib/python3.11/site-packages/pytorch_tabular/models/common/layers/soft_trees.py:138: UserWarning: Data-aware initialization is performed on less than 1000 data points. This may cause instability.To avoid potential problems, run this model on a data batch with at least 1000 data samples.You can do so manually before training. Use with torch.no_grad() for memory efficiency.
  warn(
2026-06-28 14:39:17,736 INFO [node] fold 3/5  MAE=12.29h
/home/aubjpm001/.conda/envs/portsdfl-predict/lib/python3.11/site-packages/pytorch_tabular/models/common/layers/soft_trees.py:138: UserWarning: Data-aware initialization is performed on less than 1000 data points. This may cause instability.To avoid potential problems, run this model on a data batch with at least 1000 data samples.You can do so manually before training. Use with torch.no_grad() for memory efficiency.
  warn(
2026-06-28 14:39:25,979 INFO [node] fold 4/5  MAE=11.73h
/home/aubjpm001/.conda/envs/portsdfl-predict/lib/python3.11/site-packages/pytorch_tabular/models/common/layers/soft_trees.py:138: UserWarning: Data-aware initialization is performed on less than 1000 data points. This may cause instability.To avoid potential problems, run this model on a data batch with at least 1000 data samples.You can do so manually before training. Use with torch.no_grad() for memory efficiency.
  warn(
2026-06-28 14:39:33,494 INFO [node] fold 5/5  MAE=12.00h
/home/aubjpm001/.conda/envs/portsdfl-predict/lib/python3.11/site-packages/pytorch_tabular/models/common/layers/soft_trees.py:138: UserWarning: Data-aware initialization is performed on less than 1000 data points. This may cause instability.To avoid potential problems, run this model on a data batch with at least 1000 data samples.You can do so manually before training. Use with torch.no_grad() for memory efficiency.
  warn(
2026-06-28 14:39:44,211 INFO [node] saved -> /home/aubjpm001/portsDFL/prediction_models/artifacts/node.pkl  (CV MAE 11.971 h)
2026-06-28 14:39:44,211 INFO Done. Artifacts in /home/aubjpm001/portsDFL/prediction_models/artifacts ; run scripts/compare.py for the leaderboard.
