[I 2026-06-28 14:21:01,483] Trial 25 finished with value: 11.994335263591573 and parameters: {'n_layers': 2, 'n_trees': 128, 'tree_depth': 6, 'choice_function': 'sparsemax', 'lr': 0.0015565945051844103, 'weight_decay': 2.4503522069329144e-06}. Best is trial 22 with value: 11.899724346528089.
/home/aubjpm001/.conda/envs/portsdfl-predict/lib/python3.11/site-packages/pytorch_tabular/models/common/layers/soft_trees.py:138: UserWarning: Data-aware initialization is performed on less than 1000 data points. This may cause instability.To avoid potential problems, run this model on a data batch with at least 1000 data samples.You can do so manually before training. Use with torch.no_grad() for memory efficiency.
  warn(
/home/aubjpm001/.conda/envs/portsdfl-predict/lib/python3.11/site-packages/pytorch_tabular/models/common/layers/soft_trees.py:138: UserWarning: Data-aware initialization is performed on less than 1000 data points. This may cause instability.To avoid potential problems, run this model on a data batch with at least 1000 data samples.You can do so manually before training. Use with torch.no_grad() for memory efficiency.
  warn(
/home/aubjpm001/.conda/envs/portsdfl-predict/lib/python3.11/site-packages/pytorch_tabular/models/common/layers/soft_trees.py:138: UserWarning: Data-aware initialization is performed on less than 1000 data points. This may cause instability.To avoid potential problems, run this model on a data batch with at least 1000 data samples.You can do so manually before training. Use with torch.no_grad() for memory efficiency.
  warn(
/home/aubjpm001/.conda/envs/portsdfl-predict/lib/python3.11/site-packages/pytorch_tabular/models/common/layers/soft_trees.py:138: UserWarning: Data-aware initialization is performed on less than 1000 data points. This may cause instability.To avoid potential problems, run this model on a data batch with at least 1000 data samples.You can do so manually before training. Use with torch.no_grad() for memory efficiency.
  warn(
/home/aubjpm001/.conda/envs/portsdfl-predict/lib/python3.11/site-packages/pytorch_tabular/models/common/layers/soft_trees.py:138: UserWarning: Data-aware initialization is performed on less than 1000 data points. This may cause instability.To avoid potential problems, run this model on a data batch with at least 1000 data samples.You can do so manually before training. Use with torch.no_grad() for memory efficiency.
  warn(
[I 2026-06-28 14:21:44,284] Trial 26 finished with value: 12.01500049275551 and parameters: {'n_layers': 2, 'n_trees': 128, 'tree_depth': 6, 'choice_function': 'sparsemax', 'lr': 0.002909604003142705, 'weight_decay': 8.321577076965537e-06}. Best is trial 22 with value: 11.899724346528089.
/home/aubjpm001/.conda/envs/portsdfl-predict/lib/python3.11/site-packages/pytorch_tabular/models/common/layers/soft_trees.py:138: UserWarning: Data-aware initialization is performed on less than 1000 data points. This may cause instability.To avoid potential problems, run this model on a data batch with at least 1000 data samples.You can do so manually before training. Use with torch.no_grad() for memory efficiency.
  warn(
/home/aubjpm001/.conda/envs/portsdfl-predict/lib/python3.11/site-packages/pytorch_tabular/models/common/layers/soft_trees.py:138: UserWarning: Data-aware initialization is performed on less than 1000 data points. This may cause instability.To avoid potential problems, run this model on a data batch with at least 1000 data samples.You can do so manually before training. Use with torch.no_grad() for memory efficiency.
  warn(
/home/aubjpm001/.conda/envs/portsdfl-predict/lib/python3.11/site-packages/pytorch_tabular/models/common/layers/soft_trees.py:138: UserWarning: Data-aware initialization is performed on less than 1000 data points. This may cause instability.To avoid potential problems, run this model on a data batch with at least 1000 data samples.You can do so manually before training. Use with torch.no_grad() for memory efficiency.
  warn(
/home/aubjpm001/.conda/envs/portsdfl-predict/lib/python3.11/site-packages/pytorch_tabular/models/common/layers/soft_trees.py:138: UserWarning: Data-aware initialization is performed on less than 1000 data points. This may cause instability.To avoid potential problems, run this model on a data batch with at least 1000 data samples.You can do so manually before training. Use with torch.no_grad() for memory efficiency.
  warn(
/home/aubjpm001/.conda/envs/portsdfl-predict/lib/python3.11/site-packages/pytorch_tabular/models/common/layers/soft_trees.py:138: UserWarning: Data-aware initialization is performed on less than 1000 data points. This may cause instability.To avoid potential problems, run this model on a data batch with at least 1000 data samples.You can do so manually before training. Use with torch.no_grad() for memory efficiency.
  warn(
[I 2026-06-28 14:23:24,924] Trial 27 finished with value: 12.168214412890318 and parameters: {'n_layers': 2, 'n_trees': 128, 'tree_depth': 6, 'choice_function': 'sparsemax', 'lr': 0.0005798275187093718, 'weight_decay': 2.5671101439287555e-05}. Best is trial 22 with value: 11.899724346528089.
/home/aubjpm001/.conda/envs/portsdfl-predict/lib/python3.11/site-packages/pytorch_tabular/models/common/layers/soft_trees.py:138: UserWarning: Data-aware initialization is performed on less than 1000 data points. This may cause instability.To avoid potential problems, run this model on a data batch with at least 1000 data samples.You can do so manually before training. Use with torch.no_grad() for memory efficiency.
  warn(
/home/aubjpm001/.conda/envs/portsdfl-predict/lib/python3.11/site-packages/pytorch_tabular/models/common/layers/soft_trees.py:138: UserWarning: Data-aware initialization is performed on less than 1000 data points. This may cause instability.To avoid potential problems, run this model on a data batch with at least 1000 data samples.You can do so manually before training. Use with torch.no_grad() for memory efficiency.
  warn(
/home/aubjpm001/.conda/envs/portsdfl-predict/lib/python3.11/site-packages/pytorch_tabular/models/common/layers/soft_trees.py:138: UserWarning: Data-aware initialization is performed on less than 1000 data points. This may cause instability.To avoid potential problems, run this model on a data batch with at least 1000 data samples.You can do so manually before training. Use with torch.no_grad() for memory efficiency.
  warn(
/home/aubjpm001/.conda/envs/portsdfl-predict/lib/python3.11/site-packages/pytorch_tabular/models/common/layers/soft_trees.py:138: UserWarning: Data-aware initialization is performed on less than 1000 data points. This may cause instability.To avoid potential problems, run this model on a data batch with at least 1000 data samples.You can do so manually before training. Use with torch.no_grad() for memory efficiency.
  warn(
/home/aubjpm001/.conda/envs/portsdfl-predict/lib/python3.11/site-packages/pytorch_tabular/models/common/layers/soft_trees.py:138: UserWarning: Data-aware initialization is performed on less than 1000 data points. This may cause instability.To avoid potential problems, run this model on a data batch with at least 1000 data samples.You can do so manually before training. Use with torch.no_grad() for memory efficiency.
  warn(
[I 2026-06-28 14:25:11,346] Trial 28 finished with value: 12.047317134321048 and parameters: {'n_layers': 2, 'n_trees': 128, 'tree_depth': 7, 'choice_function': 'sparsemax', 'lr': 0.0012819717099738673, 'weight_decay': 2.0806382385562885e-06}. Best is trial 22 with value: 11.899724346528089.
/home/aubjpm001/.conda/envs/portsdfl-predict/lib/python3.11/site-packages/pytorch_tabular/models/common/layers/soft_trees.py:138: UserWarning: Data-aware initialization is performed on less than 1000 data points. This may cause instability.To avoid potential problems, run this model on a data batch with at least 1000 data samples.You can do so manually before training. Use with torch.no_grad() for memory efficiency.
  warn(
/home/aubjpm001/.conda/envs/portsdfl-predict/lib/python3.11/site-packages/pytorch_tabular/models/common/layers/soft_trees.py:138: UserWarning: Data-aware initialization is performed on less than 1000 data points. This may cause instability.To avoid potential problems, run this model on a data batch with at least 1000 data samples.You can do so manually before training. Use with torch.no_grad() for memory efficiency.
  warn(
/home/aubjpm001/.conda/envs/portsdfl-predict/lib/python3.11/site-packages/pytorch_tabular/models/common/layers/soft_trees.py:138: UserWarning: Data-aware initialization is performed on less than 1000 data points. This may cause instability.To avoid potential problems, run this model on a data batch with at least 1000 data samples.You can do so manually before training. Use with torch.no_grad() for memory efficiency.
  warn(
/home/aubjpm001/.conda/envs/portsdfl-predict/lib/python3.11/site-packages/pytorch_tabular/models/common/layers/soft_trees.py:138: UserWarning: Data-aware initialization is performed on less than 1000 data points. This may cause instability.To avoid potential problems, run this model on a data batch with at least 1000 data samples.You can do so manually before training. Use with torch.no_grad() for memory efficiency.
  warn(
/home/aubjpm001/.conda/envs/portsdfl-predict/lib/python3.11/site-packages/pytorch_tabular/models/common/layers/soft_trees.py:138: UserWarning: Data-aware initialization is performed on less than 1000 data points. This may cause instability.To avoid potential problems, run this model on a data batch with at least 1000 data samples.You can do so manually before training. Use with torch.no_grad() for memory efficiency.
  warn(
[I 2026-06-28 14:26:00,590] Trial 29 finished with value: 12.029174020439697 and parameters: {'n_layers': 2, 'n_trees': 128, 'tree_depth': 6, 'choice_function': 'sparsemax', 'lr': 0.0019255014744782484, 'weight_decay': 5.304013054086878e-06}. Best is trial 22 with value: 11.899724346528089.
/home/aubjpm001/.conda/envs/portsdfl-predict/lib/python3.11/site-packages/pytorch_tabular/models/common/layers/soft_trees.py:138: UserWarning: Data-aware initialization is performed on less than 1000 data points. This may cause instability.To avoid potential problems, run this model on a data batch with at least 1000 data samples.You can do so manually before training. Use with torch.no_grad() for memory efficiency.
  warn(
/home/aubjpm001/.conda/envs/portsdfl-predict/lib/python3.11/site-packages/pytorch_tabular/models/common/layers/soft_trees.py:138: UserWarning: Data-aware initialization is performed on less than 1000 data points. This may cause instability.To avoid potential problems, run this model on a data batch with at least 1000 data samples.You can do so manually before training. Use with torch.no_grad() for memory efficiency.
  warn(
/home/aubjpm001/.conda/envs/portsdfl-predict/lib/python3.11/site-packages/pytorch_tabular/models/common/layers/soft_trees.py:138: UserWarning: Data-aware initialization is performed on less than 1000 data points. This may cause instability.To avoid potential problems, run this model on a data batch with at least 1000 data samples.You can do so manually before training. Use with torch.no_grad() for memory efficiency.
  warn(
/home/aubjpm001/.conda/envs/portsdfl-predict/lib/python3.11/site-packages/pytorch_tabular/models/common/layers/soft_trees.py:138: UserWarning: Data-aware initialization is performed on less than 1000 data points. This may cause instability.To avoid potential problems, run this model on a data batch with at least 1000 data samples.You can do so manually before training. Use with torch.no_grad() for memory efficiency.
  warn(
/home/aubjpm001/.conda/envs/portsdfl-predict/lib/python3.11/site-packages/pytorch_tabular/models/common/layers/soft_trees.py:138: UserWarning: Data-aware initialization is performed on less than 1000 data points. This may cause instability.To avoid potential problems, run this model on a data batch with at least 1000 data samples.You can do so manually before training. Use with torch.no_grad() for memory efficiency.
  warn(
[I 2026-06-28 14:28:25,051] Trial 30 finished with value: 13.696431512999464 and parameters: {'n_layers': 2, 'n_trees': 128, 'tree_depth': 6, 'choice_function': 'sparsemax', 'lr': 0.00010685327573111031, 'weight_decay': 1.5214729284973631e-05}. Best is trial 22 with value: 11.899724346528089.
/home/aubjpm001/.conda/envs/portsdfl-predict/lib/python3.11/site-packages/pytorch_tabular/models/common/layers/soft_trees.py:138: UserWarning: Data-aware initialization is performed on less than 1000 data points. This may cause instability.To avoid potential problems, run this model on a data batch with at least 1000 data samples.You can do so manually before training. Use with torch.no_grad() for memory efficiency.
  warn(
/home/aubjpm001/.conda/envs/portsdfl-predict/lib/python3.11/site-packages/pytorch_tabular/models/common/layers/soft_trees.py:138: UserWarning: Data-aware initialization is performed on less than 1000 data points. This may cause instability.To avoid potential problems, run this model on a data batch with at least 1000 data samples.You can do so manually before training. Use with torch.no_grad() for memory efficiency.
  warn(
/home/aubjpm001/.conda/envs/portsdfl-predict/lib/python3.11/site-packages/pytorch_tabular/models/common/layers/soft_trees.py:138: UserWarning: Data-aware initialization is performed on less than 1000 data points. This may cause instability.To avoid potential problems, run this model on a data batch with at least 1000 data samples.You can do so manually before training. Use with torch.no_grad() for memory efficiency.
  warn(
/home/aubjpm001/.conda/envs/portsdfl-predict/lib/python3.11/site-packages/pytorch_tabular/models/common/layers/soft_trees.py:138: UserWarning: Data-aware initialization is performed on less than 1000 data points. This may cause instability.To avoid potential problems, run this model on a data batch with at least 1000 data samples.You can do so manually before training. Use with torch.no_grad() for memory efficiency.
  warn(
/home/aubjpm001/.conda/envs/portsdfl-predict/lib/python3.11/site-packages/pytorch_tabular/models/common/layers/soft_trees.py:138: UserWarning: Data-aware initialization is performed on less than 1000 data points. This may cause instability.To avoid potential problems, run this model on a data batch with at least 1000 data samples.You can do so manually before training. Use with torch.no_grad() for memory efficiency.
  warn(
[I 2026-06-28 14:29:11,165] Trial 31 finished with value: 11.950058154465552 and parameters: {'n_layers': 2, 'n_trees': 128, 'tree_depth': 6, 'choice_function': 'sparsemax', 'lr': 0.002467283243066209, 'weight_decay': 7.945841907866747e-06}. Best is trial 22 with value: 11.899724346528089.
/home/aubjpm001/.conda/envs/portsdfl-predict/lib/python3.11/site-packages/pytorch_tabular/models/common/layers/soft_trees.py:138: UserWarning: Data-aware initialization is performed on less than 1000 data points. This may cause instability.To avoid potential problems, run this model on a data batch with at least 1000 data samples.You can do so manually before training. Use with torch.no_grad() for memory efficiency.
  warn(
/home/aubjpm001/.conda/envs/portsdfl-predict/lib/python3.11/site-packages/pytorch_tabular/models/common/layers/soft_trees.py:138: UserWarning: Data-aware initialization is performed on less than 1000 data points. This may cause instability.To avoid potential problems, run this model on a data batch with at least 1000 data samples.You can do so manually before training. Use with torch.no_grad() for memory efficiency.
  warn(
/home/aubjpm001/.conda/envs/portsdfl-predict/lib/python3.11/site-packages/pytorch_tabular/models/common/layers/soft_trees.py:138: UserWarning: Data-aware initialization is performed on less than 1000 data points. This may cause instability.To avoid potential problems, run this model on a data batch with at least 1000 data samples.You can do so manually before training. Use with torch.no_grad() for memory efficiency.
  warn(
/home/aubjpm001/.conda/envs/portsdfl-predict/lib/python3.11/site-packages/pytorch_tabular/models/common/layers/soft_trees.py:138: UserWarning: Data-aware initialization is performed on less than 1000 data points. This may cause instability.To avoid potential problems, run this model on a data batch with at least 1000 data samples.You can do so manually before training. Use with torch.no_grad() for memory efficiency.
  warn(
/home/aubjpm001/.conda/envs/portsdfl-predict/lib/python3.11/site-packages/pytorch_tabular/models/common/layers/soft_trees.py:138: UserWarning: Data-aware initialization is performed on less than 1000 data points. This may cause instability.To avoid potential problems, run this model on a data batch with at least 1000 data samples.You can do so manually before training. Use with torch.no_grad() for memory efficiency.
  warn(
[I 2026-06-28 14:29:48,150] Trial 32 finished with value: 12.032349059561893 and parameters: {'n_layers': 2, 'n_trees': 128, 'tree_depth': 6, 'choice_function': 'sparsemax', 'lr': 0.005161106885688298, 'weight_decay': 9.341630508830983e-06}. Best is trial 22 with value: 11.899724346528089.
/home/aubjpm001/.conda/envs/portsdfl-predict/lib/python3.11/site-packages/pytorch_tabular/models/common/layers/soft_trees.py:138: UserWarning: Data-aware initialization is performed on less than 1000 data points. This may cause instability.To avoid potential problems, run this model on a data batch with at least 1000 data samples.You can do so manually before training. Use with torch.no_grad() for memory efficiency.
  warn(
/home/aubjpm001/.conda/envs/portsdfl-predict/lib/python3.11/site-packages/pytorch_tabular/models/common/layers/soft_trees.py:138: UserWarning: Data-aware initialization is performed on less than 1000 data points. This may cause instability.To avoid potential problems, run this model on a data batch with at least 1000 data samples.You can do so manually before training. Use with torch.no_grad() for memory efficiency.
  warn(
/home/aubjpm001/.conda/envs/portsdfl-predict/lib/python3.11/site-packages/pytorch_tabular/models/common/layers/soft_trees.py:138: UserWarning: Data-aware initialization is performed on less than 1000 data points. This may cause instability.To avoid potential problems, run this model on a data batch with at least 1000 data samples.You can do so manually before training. Use with torch.no_grad() for memory efficiency.
  warn(
/home/aubjpm001/.conda/envs/portsdfl-predict/lib/python3.11/site-packages/pytorch_tabular/models/common/layers/soft_trees.py:138: UserWarning: Data-aware initialization is performed on less than 1000 data points. This may cause instability.To avoid potential problems, run this model on a data batch with at least 1000 data samples.You can do so manually before training. Use with torch.no_grad() for memory efficiency.
  warn(
/home/aubjpm001/.conda/envs/portsdfl-predict/lib/python3.11/site-packages/pytorch_tabular/models/common/layers/soft_trees.py:138: UserWarning: Data-aware initialization is performed on less than 1000 data points. This may cause instability.To avoid potential problems, run this model on a data batch with at least 1000 data samples.You can do so manually before training. Use with torch.no_grad() for memory efficiency.
  warn(
[I 2026-06-28 14:30:29,820] Trial 33 finished with value: 11.93675090447743 and parameters: {'n_layers': 2, 'n_trees': 128, 'tree_depth': 6, 'choice_function': 'sparsemax', 'lr': 0.0031274180777468635, 'weight_decay': 2.217332469097449e-05}. Best is trial 22 with value: 11.899724346528089.
/home/aubjpm001/.conda/envs/portsdfl-predict/lib/python3.11/site-packages/pytorch_tabular/models/common/layers/soft_trees.py:138: UserWarning: Data-aware initialization is performed on less than 1000 data points. This may cause instability.To avoid potential problems, run this model on a data batch with at least 1000 data samples.You can do so manually before training. Use with torch.no_grad() for memory efficiency.
  warn(
/home/aubjpm001/.conda/envs/portsdfl-predict/lib/python3.11/site-packages/pytorch_tabular/models/common/layers/soft_trees.py:138: UserWarning: Data-aware initialization is performed on less than 1000 data points. This may cause instability.To avoid potential problems, run this model on a data batch with at least 1000 data samples.You can do so manually before training. Use with torch.no_grad() for memory efficiency.
  warn(
/home/aubjpm001/.conda/envs/portsdfl-predict/lib/python3.11/site-packages/pytorch_tabular/models/common/layers/soft_trees.py:138: UserWarning: Data-aware initialization is performed on less than 1000 data points. This may cause instability.To avoid potential problems, run this model on a data batch with at least 1000 data samples.You can do so manually before training. Use with torch.no_grad() for memory efficiency.
  warn(
/home/aubjpm001/.conda/envs/portsdfl-predict/lib/python3.11/site-packages/pytorch_tabular/models/common/layers/soft_trees.py:138: UserWarning: Data-aware initialization is performed on less than 1000 data points. This may cause instability.To avoid potential problems, run this model on a data batch with at least 1000 data samples.You can do so manually before training. Use with torch.no_grad() for memory efficiency.
  warn(
/home/aubjpm001/.conda/envs/portsdfl-predict/lib/python3.11/site-packages/pytorch_tabular/models/common/layers/soft_trees.py:138: UserWarning: Data-aware initialization is performed on less than 1000 data points. This may cause instability.To avoid potential problems, run this model on a data batch with at least 1000 data samples.You can do so manually before training. Use with torch.no_grad() for memory efficiency.
  warn(
