[I 2026-06-28 13:39:42,811] Trial 7 finished with value: 12.06067845474075 and parameters: {'n_layers': 4, 'n_trees': 256, 'tree_depth': 8, 'choice_function': 'sparsemax', 'lr': 0.0035033984911586884, 'weight_decay': 3.945908811099999e-06}. Best is trial 2 with value: 11.961620532345943.
/home/aubjpm001/.conda/envs/portsdfl-predict/lib/python3.11/site-packages/pytorch_tabular/models/common/layers/soft_trees.py:138: UserWarning: Data-aware initialization is performed on less than 1000 data points. This may cause instability.To avoid potential problems, run this model on a data batch with at least 1000 data samples.You can do so manually before training. Use with torch.no_grad() for memory efficiency.
  warn(
/home/aubjpm001/.conda/envs/portsdfl-predict/lib/python3.11/site-packages/pytorch_tabular/models/common/layers/soft_trees.py:138: UserWarning: Data-aware initialization is performed on less than 1000 data points. This may cause instability.To avoid potential problems, run this model on a data batch with at least 1000 data samples.You can do so manually before training. Use with torch.no_grad() for memory efficiency.
  warn(
/home/aubjpm001/.conda/envs/portsdfl-predict/lib/python3.11/site-packages/pytorch_tabular/models/common/layers/soft_trees.py:138: UserWarning: Data-aware initialization is performed on less than 1000 data points. This may cause instability.To avoid potential problems, run this model on a data batch with at least 1000 data samples.You can do so manually before training. Use with torch.no_grad() for memory efficiency.
  warn(
/home/aubjpm001/.conda/envs/portsdfl-predict/lib/python3.11/site-packages/pytorch_tabular/models/common/layers/soft_trees.py:138: UserWarning: Data-aware initialization is performed on less than 1000 data points. This may cause instability.To avoid potential problems, run this model on a data batch with at least 1000 data samples.You can do so manually before training. Use with torch.no_grad() for memory efficiency.
  warn(
/home/aubjpm001/.conda/envs/portsdfl-predict/lib/python3.11/site-packages/pytorch_tabular/models/common/layers/soft_trees.py:138: UserWarning: Data-aware initialization is performed on less than 1000 data points. This may cause instability.To avoid potential problems, run this model on a data batch with at least 1000 data samples.You can do so manually before training. Use with torch.no_grad() for memory efficiency.
  warn(
[I 2026-06-28 13:46:19,408] Trial 8 finished with value: 13.074128022058185 and parameters: {'n_layers': 2, 'n_trees': 128, 'tree_depth': 8, 'choice_function': 'sparsemax', 'lr': 0.0001705053926026929, 'weight_decay': 0.00038842777547031416}. Best is trial 2 with value: 11.961620532345943.
/home/aubjpm001/.conda/envs/portsdfl-predict/lib/python3.11/site-packages/pytorch_tabular/models/common/layers/soft_trees.py:138: UserWarning: Data-aware initialization is performed on less than 1000 data points. This may cause instability.To avoid potential problems, run this model on a data batch with at least 1000 data samples.You can do so manually before training. Use with torch.no_grad() for memory efficiency.
  warn(
/home/aubjpm001/.conda/envs/portsdfl-predict/lib/python3.11/site-packages/pytorch_tabular/models/common/layers/soft_trees.py:138: UserWarning: Data-aware initialization is performed on less than 1000 data points. This may cause instability.To avoid potential problems, run this model on a data batch with at least 1000 data samples.You can do so manually before training. Use with torch.no_grad() for memory efficiency.
  warn(
/home/aubjpm001/.conda/envs/portsdfl-predict/lib/python3.11/site-packages/pytorch_tabular/models/common/layers/soft_trees.py:138: UserWarning: Data-aware initialization is performed on less than 1000 data points. This may cause instability.To avoid potential problems, run this model on a data batch with at least 1000 data samples.You can do so manually before training. Use with torch.no_grad() for memory efficiency.
  warn(
/home/aubjpm001/.conda/envs/portsdfl-predict/lib/python3.11/site-packages/pytorch_tabular/models/common/layers/soft_trees.py:138: UserWarning: Data-aware initialization is performed on less than 1000 data points. This may cause instability.To avoid potential problems, run this model on a data batch with at least 1000 data samples.You can do so manually before training. Use with torch.no_grad() for memory efficiency.
  warn(
/home/aubjpm001/.conda/envs/portsdfl-predict/lib/python3.11/site-packages/pytorch_tabular/models/common/layers/soft_trees.py:138: UserWarning: Data-aware initialization is performed on less than 1000 data points. This may cause instability.To avoid potential problems, run this model on a data batch with at least 1000 data samples.You can do so manually before training. Use with torch.no_grad() for memory efficiency.
  warn(
[I 2026-06-28 13:47:11,000] Trial 9 finished with value: 12.123414847400293 and parameters: {'n_layers': 4, 'n_trees': 128, 'tree_depth': 6, 'choice_function': 'entmax15', 'lr': 0.0059487468132197715, 'weight_decay': 2.6100256506134754e-05}. Best is trial 2 with value: 11.961620532345943.
/home/aubjpm001/.conda/envs/portsdfl-predict/lib/python3.11/site-packages/pytorch_tabular/models/common/layers/soft_trees.py:138: UserWarning: Data-aware initialization is performed on less than 1000 data points. This may cause instability.To avoid potential problems, run this model on a data batch with at least 1000 data samples.You can do so manually before training. Use with torch.no_grad() for memory efficiency.
  warn(
/home/aubjpm001/.conda/envs/portsdfl-predict/lib/python3.11/site-packages/pytorch_tabular/models/common/layers/soft_trees.py:138: UserWarning: Data-aware initialization is performed on less than 1000 data points. This may cause instability.To avoid potential problems, run this model on a data batch with at least 1000 data samples.You can do so manually before training. Use with torch.no_grad() for memory efficiency.
  warn(
/home/aubjpm001/.conda/envs/portsdfl-predict/lib/python3.11/site-packages/pytorch_tabular/models/common/layers/soft_trees.py:138: UserWarning: Data-aware initialization is performed on less than 1000 data points. This may cause instability.To avoid potential problems, run this model on a data batch with at least 1000 data samples.You can do so manually before training. Use with torch.no_grad() for memory efficiency.
  warn(
/home/aubjpm001/.conda/envs/portsdfl-predict/lib/python3.11/site-packages/pytorch_tabular/models/common/layers/soft_trees.py:138: UserWarning: Data-aware initialization is performed on less than 1000 data points. This may cause instability.To avoid potential problems, run this model on a data batch with at least 1000 data samples.You can do so manually before training. Use with torch.no_grad() for memory efficiency.
  warn(
/home/aubjpm001/.conda/envs/portsdfl-predict/lib/python3.11/site-packages/pytorch_tabular/models/common/layers/soft_trees.py:138: UserWarning: Data-aware initialization is performed on less than 1000 data points. This may cause instability.To avoid potential problems, run this model on a data batch with at least 1000 data samples.You can do so manually before training. Use with torch.no_grad() for memory efficiency.
  warn(
[I 2026-06-28 13:49:47,212] Trial 10 finished with value: 12.144469766089971 and parameters: {'n_layers': 6, 'n_trees': 256, 'tree_depth': 7, 'choice_function': 'sparsemax', 'lr': 0.001755285413313033, 'weight_decay': 1.306699123790696e-06}. Best is trial 2 with value: 11.961620532345943.
/home/aubjpm001/.conda/envs/portsdfl-predict/lib/python3.11/site-packages/pytorch_tabular/models/common/layers/soft_trees.py:138: UserWarning: Data-aware initialization is performed on less than 1000 data points. This may cause instability.To avoid potential problems, run this model on a data batch with at least 1000 data samples.You can do so manually before training. Use with torch.no_grad() for memory efficiency.
  warn(
/home/aubjpm001/.conda/envs/portsdfl-predict/lib/python3.11/site-packages/pytorch_tabular/models/common/layers/soft_trees.py:138: UserWarning: Data-aware initialization is performed on less than 1000 data points. This may cause instability.To avoid potential problems, run this model on a data batch with at least 1000 data samples.You can do so manually before training. Use with torch.no_grad() for memory efficiency.
  warn(
/home/aubjpm001/.conda/envs/portsdfl-predict/lib/python3.11/site-packages/pytorch_tabular/models/common/layers/soft_trees.py:138: UserWarning: Data-aware initialization is performed on less than 1000 data points. This may cause instability.To avoid potential problems, run this model on a data batch with at least 1000 data samples.You can do so manually before training. Use with torch.no_grad() for memory efficiency.
  warn(
/home/aubjpm001/.conda/envs/portsdfl-predict/lib/python3.11/site-packages/pytorch_tabular/models/common/layers/soft_trees.py:138: UserWarning: Data-aware initialization is performed on less than 1000 data points. This may cause instability.To avoid potential problems, run this model on a data batch with at least 1000 data samples.You can do so manually before training. Use with torch.no_grad() for memory efficiency.
  warn(
/home/aubjpm001/.conda/envs/portsdfl-predict/lib/python3.11/site-packages/pytorch_tabular/models/common/layers/soft_trees.py:138: UserWarning: Data-aware initialization is performed on less than 1000 data points. This may cause instability.To avoid potential problems, run this model on a data batch with at least 1000 data samples.You can do so manually before training. Use with torch.no_grad() for memory efficiency.
  warn(
[I 2026-06-28 13:51:36,038] Trial 11 finished with value: 12.105084668986411 and parameters: {'n_layers': 2, 'n_trees': 128, 'tree_depth': 7, 'choice_function': 'entmax15', 'lr': 0.0025977297006269176, 'weight_decay': 4.958763738413052e-05}. Best is trial 2 with value: 11.961620532345943.
/home/aubjpm001/.conda/envs/portsdfl-predict/lib/python3.11/site-packages/pytorch_tabular/models/common/layers/soft_trees.py:138: UserWarning: Data-aware initialization is performed on less than 1000 data points. This may cause instability.To avoid potential problems, run this model on a data batch with at least 1000 data samples.You can do so manually before training. Use with torch.no_grad() for memory efficiency.
  warn(
/home/aubjpm001/.conda/envs/portsdfl-predict/lib/python3.11/site-packages/pytorch_tabular/models/common/layers/soft_trees.py:138: UserWarning: Data-aware initialization is performed on less than 1000 data points. This may cause instability.To avoid potential problems, run this model on a data batch with at least 1000 data samples.You can do so manually before training. Use with torch.no_grad() for memory efficiency.
  warn(
/home/aubjpm001/.conda/envs/portsdfl-predict/lib/python3.11/site-packages/pytorch_tabular/models/common/layers/soft_trees.py:138: UserWarning: Data-aware initialization is performed on less than 1000 data points. This may cause instability.To avoid potential problems, run this model on a data batch with at least 1000 data samples.You can do so manually before training. Use with torch.no_grad() for memory efficiency.
  warn(
/home/aubjpm001/.conda/envs/portsdfl-predict/lib/python3.11/site-packages/pytorch_tabular/models/common/layers/soft_trees.py:138: UserWarning: Data-aware initialization is performed on less than 1000 data points. This may cause instability.To avoid potential problems, run this model on a data batch with at least 1000 data samples.You can do so manually before training. Use with torch.no_grad() for memory efficiency.
  warn(
/home/aubjpm001/.conda/envs/portsdfl-predict/lib/python3.11/site-packages/pytorch_tabular/models/common/layers/soft_trees.py:138: UserWarning: Data-aware initialization is performed on less than 1000 data points. This may cause instability.To avoid potential problems, run this model on a data batch with at least 1000 data samples.You can do so manually before training. Use with torch.no_grad() for memory efficiency.
  warn(
[I 2026-06-28 13:56:04,374] Trial 12 finished with value: 12.233142085382072 and parameters: {'n_layers': 6, 'n_trees': 256, 'tree_depth': 7, 'choice_function': 'entmax15', 'lr': 0.0014014640289440811, 'weight_decay': 1.1109859827059598e-05}. Best is trial 2 with value: 11.961620532345943.
/home/aubjpm001/.conda/envs/portsdfl-predict/lib/python3.11/site-packages/pytorch_tabular/models/common/layers/soft_trees.py:138: UserWarning: Data-aware initialization is performed on less than 1000 data points. This may cause instability.To avoid potential problems, run this model on a data batch with at least 1000 data samples.You can do so manually before training. Use with torch.no_grad() for memory efficiency.
  warn(
/home/aubjpm001/.conda/envs/portsdfl-predict/lib/python3.11/site-packages/pytorch_tabular/models/common/layers/soft_trees.py:138: UserWarning: Data-aware initialization is performed on less than 1000 data points. This may cause instability.To avoid potential problems, run this model on a data batch with at least 1000 data samples.You can do so manually before training. Use with torch.no_grad() for memory efficiency.
  warn(
/home/aubjpm001/.conda/envs/portsdfl-predict/lib/python3.11/site-packages/pytorch_tabular/models/common/layers/soft_trees.py:138: UserWarning: Data-aware initialization is performed on less than 1000 data points. This may cause instability.To avoid potential problems, run this model on a data batch with at least 1000 data samples.You can do so manually before training. Use with torch.no_grad() for memory efficiency.
  warn(
/home/aubjpm001/.conda/envs/portsdfl-predict/lib/python3.11/site-packages/pytorch_tabular/models/common/layers/soft_trees.py:138: UserWarning: Data-aware initialization is performed on less than 1000 data points. This may cause instability.To avoid potential problems, run this model on a data batch with at least 1000 data samples.You can do so manually before training. Use with torch.no_grad() for memory efficiency.
  warn(
/home/aubjpm001/.conda/envs/portsdfl-predict/lib/python3.11/site-packages/pytorch_tabular/models/common/layers/soft_trees.py:138: UserWarning: Data-aware initialization is performed on less than 1000 data points. This may cause instability.To avoid potential problems, run this model on a data batch with at least 1000 data samples.You can do so manually before training. Use with torch.no_grad() for memory efficiency.
  warn(
[I 2026-06-28 13:58:49,097] Trial 13 finished with value: 12.061658047039828 and parameters: {'n_layers': 4, 'n_trees': 128, 'tree_depth': 7, 'choice_function': 'entmax15', 'lr': 0.0010451166230199707, 'weight_decay': 9.936127598609257e-05}. Best is trial 2 with value: 11.961620532345943.
/home/aubjpm001/.conda/envs/portsdfl-predict/lib/python3.11/site-packages/pytorch_tabular/models/common/layers/soft_trees.py:138: UserWarning: Data-aware initialization is performed on less than 1000 data points. This may cause instability.To avoid potential problems, run this model on a data batch with at least 1000 data samples.You can do so manually before training. Use with torch.no_grad() for memory efficiency.
  warn(
/home/aubjpm001/.conda/envs/portsdfl-predict/lib/python3.11/site-packages/pytorch_tabular/models/common/layers/soft_trees.py:138: UserWarning: Data-aware initialization is performed on less than 1000 data points. This may cause instability.To avoid potential problems, run this model on a data batch with at least 1000 data samples.You can do so manually before training. Use with torch.no_grad() for memory efficiency.
  warn(
/home/aubjpm001/.conda/envs/portsdfl-predict/lib/python3.11/site-packages/pytorch_tabular/models/common/layers/soft_trees.py:138: UserWarning: Data-aware initialization is performed on less than 1000 data points. This may cause instability.To avoid potential problems, run this model on a data batch with at least 1000 data samples.You can do so manually before training. Use with torch.no_grad() for memory efficiency.
  warn(
/home/aubjpm001/.conda/envs/portsdfl-predict/lib/python3.11/site-packages/pytorch_tabular/models/common/layers/soft_trees.py:138: UserWarning: Data-aware initialization is performed on less than 1000 data points. This may cause instability.To avoid potential problems, run this model on a data batch with at least 1000 data samples.You can do so manually before training. Use with torch.no_grad() for memory efficiency.
  warn(
/home/aubjpm001/.conda/envs/portsdfl-predict/lib/python3.11/site-packages/pytorch_tabular/models/common/layers/soft_trees.py:138: UserWarning: Data-aware initialization is performed on less than 1000 data points. This may cause instability.To avoid potential problems, run this model on a data batch with at least 1000 data samples.You can do so manually before training. Use with torch.no_grad() for memory efficiency.
  warn(
[I 2026-06-28 14:00:39,410] Trial 14 finished with value: 12.10335214330255 and parameters: {'n_layers': 4, 'n_trees': 512, 'tree_depth': 6, 'choice_function': 'sparsemax', 'lr': 0.003428300518485884, 'weight_decay': 1.0829361126224015e-06}. Best is trial 2 with value: 11.961620532345943.
/home/aubjpm001/.conda/envs/portsdfl-predict/lib/python3.11/site-packages/pytorch_tabular/models/common/layers/soft_trees.py:138: UserWarning: Data-aware initialization is performed on less than 1000 data points. This may cause instability.To avoid potential problems, run this model on a data batch with at least 1000 data samples.You can do so manually before training. Use with torch.no_grad() for memory efficiency.
  warn(
/home/aubjpm001/.conda/envs/portsdfl-predict/lib/python3.11/site-packages/pytorch_tabular/models/common/layers/soft_trees.py:138: UserWarning: Data-aware initialization is performed on less than 1000 data points. This may cause instability.To avoid potential problems, run this model on a data batch with at least 1000 data samples.You can do so manually before training. Use with torch.no_grad() for memory efficiency.
  warn(
/home/aubjpm001/.conda/envs/portsdfl-predict/lib/python3.11/site-packages/pytorch_tabular/models/common/layers/soft_trees.py:138: UserWarning: Data-aware initialization is performed on less than 1000 data points. This may cause instability.To avoid potential problems, run this model on a data batch with at least 1000 data samples.You can do so manually before training. Use with torch.no_grad() for memory efficiency.
  warn(
/home/aubjpm001/.conda/envs/portsdfl-predict/lib/python3.11/site-packages/pytorch_tabular/models/common/layers/soft_trees.py:138: UserWarning: Data-aware initialization is performed on less than 1000 data points. This may cause instability.To avoid potential problems, run this model on a data batch with at least 1000 data samples.You can do so manually before training. Use with torch.no_grad() for memory efficiency.
  warn(
/home/aubjpm001/.conda/envs/portsdfl-predict/lib/python3.11/site-packages/pytorch_tabular/models/common/layers/soft_trees.py:138: UserWarning: Data-aware initialization is performed on less than 1000 data points. This may cause instability.To avoid potential problems, run this model on a data batch with at least 1000 data samples.You can do so manually before training. Use with torch.no_grad() for memory efficiency.
  warn(
[I 2026-06-28 14:05:37,070] Trial 15 finished with value: 12.213951525321054 and parameters: {'n_layers': 6, 'n_trees': 256, 'tree_depth': 7, 'choice_function': 'entmax15', 'lr': 0.0008769230353126272, 'weight_decay': 0.000113897403692314}. Best is trial 2 with value: 11.961620532345943.
/home/aubjpm001/.conda/envs/portsdfl-predict/lib/python3.11/site-packages/pytorch_tabular/models/common/layers/soft_trees.py:138: UserWarning: Data-aware initialization is performed on less than 1000 data points. This may cause instability.To avoid potential problems, run this model on a data batch with at least 1000 data samples.You can do so manually before training. Use with torch.no_grad() for memory efficiency.
  warn(
/home/aubjpm001/.conda/envs/portsdfl-predict/lib/python3.11/site-packages/pytorch_tabular/models/common/layers/soft_trees.py:138: UserWarning: Data-aware initialization is performed on less than 1000 data points. This may cause instability.To avoid potential problems, run this model on a data batch with at least 1000 data samples.You can do so manually before training. Use with torch.no_grad() for memory efficiency.
  warn(
/home/aubjpm001/.conda/envs/portsdfl-predict/lib/python3.11/site-packages/pytorch_tabular/models/common/layers/soft_trees.py:138: UserWarning: Data-aware initialization is performed on less than 1000 data points. This may cause instability.To avoid potential problems, run this model on a data batch with at least 1000 data samples.You can do so manually before training. Use with torch.no_grad() for memory efficiency.
  warn(
/home/aubjpm001/.conda/envs/portsdfl-predict/lib/python3.11/site-packages/pytorch_tabular/models/common/layers/soft_trees.py:138: UserWarning: Data-aware initialization is performed on less than 1000 data points. This may cause instability.To avoid potential problems, run this model on a data batch with at least 1000 data samples.You can do so manually before training. Use with torch.no_grad() for memory efficiency.
  warn(
/home/aubjpm001/.conda/envs/portsdfl-predict/lib/python3.11/site-packages/pytorch_tabular/models/common/layers/soft_trees.py:138: UserWarning: Data-aware initialization is performed on less than 1000 data points. This may cause instability.To avoid potential problems, run this model on a data batch with at least 1000 data samples.You can do so manually before training. Use with torch.no_grad() for memory efficiency.
  warn(
