
The following have been reloaded with a version change:
  1) cuda/12.6.0_rocky9 => cuda/11.8.0       4) mpc/1.1.0-mheibzt => mpc/1.3.1
  2) gcc/11.3.0-o2cd4vz => gcc/9.5.0_all     5) mpfr/3.1.6-3ojkize => mpfr/4.2.0
  3) gmp/6.2.1-sh44noy => gmp/6.2.1

[Sun Jun 28 13:25:11 CDT 2026] Training 'node' on asaxg005 | data=/home/aubjpm001/portsDFL/data/training_dataset.csv
2026-06-28 13:25:16,098 INFO Loading dataset...
2026-06-28 13:25:16,128 INFO rows=5589 folds=5 models=['node']
2026-06-28 13:25:16,132 INFO === node (neural, 40 trials) ===
[I 2026-06-28 13:25:16,696] A new study created in RDB with name: node
/home/aubjpm001/.conda/envs/portsdfl-predict/lib/python3.11/site-packages/pytorch_tabular/models/common/layers/soft_trees.py:138: UserWarning: Data-aware initialization is performed on less than 1000 data points. This may cause instability.To avoid potential problems, run this model on a data batch with at least 1000 data samples.You can do so manually before training. Use with torch.no_grad() for memory efficiency.
  warn(
/home/aubjpm001/.conda/envs/portsdfl-predict/lib/python3.11/site-packages/pytorch_tabular/models/common/layers/soft_trees.py:138: UserWarning: Data-aware initialization is performed on less than 1000 data points. This may cause instability.To avoid potential problems, run this model on a data batch with at least 1000 data samples.You can do so manually before training. Use with torch.no_grad() for memory efficiency.
  warn(
/home/aubjpm001/.conda/envs/portsdfl-predict/lib/python3.11/site-packages/pytorch_tabular/models/common/layers/soft_trees.py:138: UserWarning: Data-aware initialization is performed on less than 1000 data points. This may cause instability.To avoid potential problems, run this model on a data batch with at least 1000 data samples.You can do so manually before training. Use with torch.no_grad() for memory efficiency.
  warn(
/home/aubjpm001/.conda/envs/portsdfl-predict/lib/python3.11/site-packages/pytorch_tabular/models/common/layers/soft_trees.py:138: UserWarning: Data-aware initialization is performed on less than 1000 data points. This may cause instability.To avoid potential problems, run this model on a data batch with at least 1000 data samples.You can do so manually before training. Use with torch.no_grad() for memory efficiency.
  warn(
/home/aubjpm001/.conda/envs/portsdfl-predict/lib/python3.11/site-packages/pytorch_tabular/models/common/layers/soft_trees.py:138: UserWarning: Data-aware initialization is performed on less than 1000 data points. This may cause instability.To avoid potential problems, run this model on a data batch with at least 1000 data samples.You can do so manually before training. Use with torch.no_grad() for memory efficiency.
  warn(
[I 2026-06-28 13:26:16,820] Trial 0 finished with value: 11.997502243753967 and parameters: {'n_layers': 4, 'n_trees': 128, 'tree_depth': 6, 'choice_function': 'entmax15', 'lr': 0.005399484409787433, 'weight_decay': 6.358358856676247e-05}. Best is trial 0 with value: 11.997502243753967.
/home/aubjpm001/.conda/envs/portsdfl-predict/lib/python3.11/site-packages/pytorch_tabular/models/common/layers/soft_trees.py:138: UserWarning: Data-aware initialization is performed on less than 1000 data points. This may cause instability.To avoid potential problems, run this model on a data batch with at least 1000 data samples.You can do so manually before training. Use with torch.no_grad() for memory efficiency.
  warn(
/home/aubjpm001/.conda/envs/portsdfl-predict/lib/python3.11/site-packages/pytorch_tabular/models/common/layers/soft_trees.py:138: UserWarning: Data-aware initialization is performed on less than 1000 data points. This may cause instability.To avoid potential problems, run this model on a data batch with at least 1000 data samples.You can do so manually before training. Use with torch.no_grad() for memory efficiency.
  warn(
/home/aubjpm001/.conda/envs/portsdfl-predict/lib/python3.11/site-packages/pytorch_tabular/models/common/layers/soft_trees.py:138: UserWarning: Data-aware initialization is performed on less than 1000 data points. This may cause instability.To avoid potential problems, run this model on a data batch with at least 1000 data samples.You can do so manually before training. Use with torch.no_grad() for memory efficiency.
  warn(
/home/aubjpm001/.conda/envs/portsdfl-predict/lib/python3.11/site-packages/pytorch_tabular/models/common/layers/soft_trees.py:138: UserWarning: Data-aware initialization is performed on less than 1000 data points. This may cause instability.To avoid potential problems, run this model on a data batch with at least 1000 data samples.You can do so manually before training. Use with torch.no_grad() for memory efficiency.
  warn(
/home/aubjpm001/.conda/envs/portsdfl-predict/lib/python3.11/site-packages/pytorch_tabular/models/common/layers/soft_trees.py:138: UserWarning: Data-aware initialization is performed on less than 1000 data points. This may cause instability.To avoid potential problems, run this model on a data batch with at least 1000 data samples.You can do so manually before training. Use with torch.no_grad() for memory efficiency.
  warn(
[I 2026-06-28 13:28:28,995] Trial 1 finished with value: 12.020896399959218 and parameters: {'n_layers': 6, 'n_trees': 256, 'tree_depth': 6, 'choice_function': 'sparsemax', 'lr': 0.0004059611610484307, 'weight_decay': 3.752055855124284e-05}. Best is trial 0 with value: 11.997502243753967.
/home/aubjpm001/.conda/envs/portsdfl-predict/lib/python3.11/site-packages/pytorch_tabular/models/common/layers/soft_trees.py:138: UserWarning: Data-aware initialization is performed on less than 1000 data points. This may cause instability.To avoid potential problems, run this model on a data batch with at least 1000 data samples.You can do so manually before training. Use with torch.no_grad() for memory efficiency.
  warn(
/home/aubjpm001/.conda/envs/portsdfl-predict/lib/python3.11/site-packages/pytorch_tabular/models/common/layers/soft_trees.py:138: UserWarning: Data-aware initialization is performed on less than 1000 data points. This may cause instability.To avoid potential problems, run this model on a data batch with at least 1000 data samples.You can do so manually before training. Use with torch.no_grad() for memory efficiency.
  warn(
/home/aubjpm001/.conda/envs/portsdfl-predict/lib/python3.11/site-packages/pytorch_tabular/models/common/layers/soft_trees.py:138: UserWarning: Data-aware initialization is performed on less than 1000 data points. This may cause instability.To avoid potential problems, run this model on a data batch with at least 1000 data samples.You can do so manually before training. Use with torch.no_grad() for memory efficiency.
  warn(
/home/aubjpm001/.conda/envs/portsdfl-predict/lib/python3.11/site-packages/pytorch_tabular/models/common/layers/soft_trees.py:138: UserWarning: Data-aware initialization is performed on less than 1000 data points. This may cause instability.To avoid potential problems, run this model on a data batch with at least 1000 data samples.You can do so manually before training. Use with torch.no_grad() for memory efficiency.
  warn(
/home/aubjpm001/.conda/envs/portsdfl-predict/lib/python3.11/site-packages/pytorch_tabular/models/common/layers/soft_trees.py:138: UserWarning: Data-aware initialization is performed on less than 1000 data points. This may cause instability.To avoid potential problems, run this model on a data batch with at least 1000 data samples.You can do so manually before training. Use with torch.no_grad() for memory efficiency.
  warn(
[I 2026-06-28 13:29:30,676] Trial 2 finished with value: 11.961620532345943 and parameters: {'n_layers': 4, 'n_trees': 256, 'tree_depth': 6, 'choice_function': 'sparsemax', 'lr': 0.0037183641805732083, 'weight_decay': 3.972110727381911e-06}. Best is trial 2 with value: 11.961620532345943.
/home/aubjpm001/.conda/envs/portsdfl-predict/lib/python3.11/site-packages/pytorch_tabular/models/common/layers/soft_trees.py:138: UserWarning: Data-aware initialization is performed on less than 1000 data points. This may cause instability.To avoid potential problems, run this model on a data batch with at least 1000 data samples.You can do so manually before training. Use with torch.no_grad() for memory efficiency.
  warn(
/home/aubjpm001/.conda/envs/portsdfl-predict/lib/python3.11/site-packages/pytorch_tabular/models/common/layers/soft_trees.py:138: UserWarning: Data-aware initialization is performed on less than 1000 data points. This may cause instability.To avoid potential problems, run this model on a data batch with at least 1000 data samples.You can do so manually before training. Use with torch.no_grad() for memory efficiency.
  warn(
/home/aubjpm001/.conda/envs/portsdfl-predict/lib/python3.11/site-packages/pytorch_tabular/models/common/layers/soft_trees.py:138: UserWarning: Data-aware initialization is performed on less than 1000 data points. This may cause instability.To avoid potential problems, run this model on a data batch with at least 1000 data samples.You can do so manually before training. Use with torch.no_grad() for memory efficiency.
  warn(
/home/aubjpm001/.conda/envs/portsdfl-predict/lib/python3.11/site-packages/pytorch_tabular/models/common/layers/soft_trees.py:138: UserWarning: Data-aware initialization is performed on less than 1000 data points. This may cause instability.To avoid potential problems, run this model on a data batch with at least 1000 data samples.You can do so manually before training. Use with torch.no_grad() for memory efficiency.
  warn(
/home/aubjpm001/.conda/envs/portsdfl-predict/lib/python3.11/site-packages/pytorch_tabular/models/common/layers/soft_trees.py:138: UserWarning: Data-aware initialization is performed on less than 1000 data points. This may cause instability.To avoid potential problems, run this model on a data batch with at least 1000 data samples.You can do so manually before training. Use with torch.no_grad() for memory efficiency.
  warn(
[I 2026-06-28 13:31:15,183] Trial 3 finished with value: 12.167524154997945 and parameters: {'n_layers': 4, 'n_trees': 512, 'tree_depth': 6, 'choice_function': 'sparsemax', 'lr': 0.00853618986286683, 'weight_decay': 0.0002661901888489054}. Best is trial 2 with value: 11.961620532345943.
/home/aubjpm001/.conda/envs/portsdfl-predict/lib/python3.11/site-packages/pytorch_tabular/models/common/layers/soft_trees.py:138: UserWarning: Data-aware initialization is performed on less than 1000 data points. This may cause instability.To avoid potential problems, run this model on a data batch with at least 1000 data samples.You can do so manually before training. Use with torch.no_grad() for memory efficiency.
  warn(
/home/aubjpm001/.conda/envs/portsdfl-predict/lib/python3.11/site-packages/pytorch_tabular/models/common/layers/soft_trees.py:138: UserWarning: Data-aware initialization is performed on less than 1000 data points. This may cause instability.To avoid potential problems, run this model on a data batch with at least 1000 data samples.You can do so manually before training. Use with torch.no_grad() for memory efficiency.
  warn(
/home/aubjpm001/.conda/envs/portsdfl-predict/lib/python3.11/site-packages/pytorch_tabular/models/common/layers/soft_trees.py:138: UserWarning: Data-aware initialization is performed on less than 1000 data points. This may cause instability.To avoid potential problems, run this model on a data batch with at least 1000 data samples.You can do so manually before training. Use with torch.no_grad() for memory efficiency.
  warn(
/home/aubjpm001/.conda/envs/portsdfl-predict/lib/python3.11/site-packages/pytorch_tabular/models/common/layers/soft_trees.py:138: UserWarning: Data-aware initialization is performed on less than 1000 data points. This may cause instability.To avoid potential problems, run this model on a data batch with at least 1000 data samples.You can do so manually before training. Use with torch.no_grad() for memory efficiency.
  warn(
/home/aubjpm001/.conda/envs/portsdfl-predict/lib/python3.11/site-packages/pytorch_tabular/models/common/layers/soft_trees.py:138: UserWarning: Data-aware initialization is performed on less than 1000 data points. This may cause instability.To avoid potential problems, run this model on a data batch with at least 1000 data samples.You can do so manually before training. Use with torch.no_grad() for memory efficiency.
  warn(
[I 2026-06-28 13:32:09,570] Trial 4 finished with value: 12.064657775294226 and parameters: {'n_layers': 2, 'n_trees': 256, 'tree_depth': 6, 'choice_function': 'entmax15', 'lr': 0.006586289317583112, 'weight_decay': 5.975027999960295e-06}. Best is trial 2 with value: 11.961620532345943.
/home/aubjpm001/.conda/envs/portsdfl-predict/lib/python3.11/site-packages/pytorch_tabular/models/common/layers/soft_trees.py:138: UserWarning: Data-aware initialization is performed on less than 1000 data points. This may cause instability.To avoid potential problems, run this model on a data batch with at least 1000 data samples.You can do so manually before training. Use with torch.no_grad() for memory efficiency.
  warn(
/home/aubjpm001/.conda/envs/portsdfl-predict/lib/python3.11/site-packages/pytorch_tabular/models/common/layers/soft_trees.py:138: UserWarning: Data-aware initialization is performed on less than 1000 data points. This may cause instability.To avoid potential problems, run this model on a data batch with at least 1000 data samples.You can do so manually before training. Use with torch.no_grad() for memory efficiency.
  warn(
/home/aubjpm001/.conda/envs/portsdfl-predict/lib/python3.11/site-packages/pytorch_tabular/models/common/layers/soft_trees.py:138: UserWarning: Data-aware initialization is performed on less than 1000 data points. This may cause instability.To avoid potential problems, run this model on a data batch with at least 1000 data samples.You can do so manually before training. Use with torch.no_grad() for memory efficiency.
  warn(
/home/aubjpm001/.conda/envs/portsdfl-predict/lib/python3.11/site-packages/pytorch_tabular/models/common/layers/soft_trees.py:138: UserWarning: Data-aware initialization is performed on less than 1000 data points. This may cause instability.To avoid potential problems, run this model on a data batch with at least 1000 data samples.You can do so manually before training. Use with torch.no_grad() for memory efficiency.
  warn(
/home/aubjpm001/.conda/envs/portsdfl-predict/lib/python3.11/site-packages/pytorch_tabular/models/common/layers/soft_trees.py:138: UserWarning: Data-aware initialization is performed on less than 1000 data points. This may cause instability.To avoid potential problems, run this model on a data batch with at least 1000 data samples.You can do so manually before training. Use with torch.no_grad() for memory efficiency.
  warn(
[I 2026-06-28 13:34:21,182] Trial 5 finished with value: 12.194524066485112 and parameters: {'n_layers': 4, 'n_trees': 512, 'tree_depth': 6, 'choice_function': 'entmax15', 'lr': 0.007568292060167618, 'weight_decay': 0.00048359527764659497}. Best is trial 2 with value: 11.961620532345943.
/home/aubjpm001/.conda/envs/portsdfl-predict/lib/python3.11/site-packages/pytorch_tabular/models/common/layers/soft_trees.py:138: UserWarning: Data-aware initialization is performed on less than 1000 data points. This may cause instability.To avoid potential problems, run this model on a data batch with at least 1000 data samples.You can do so manually before training. Use with torch.no_grad() for memory efficiency.
  warn(
/home/aubjpm001/.conda/envs/portsdfl-predict/lib/python3.11/site-packages/pytorch_tabular/models/common/layers/soft_trees.py:138: UserWarning: Data-aware initialization is performed on less than 1000 data points. This may cause instability.To avoid potential problems, run this model on a data batch with at least 1000 data samples.You can do so manually before training. Use with torch.no_grad() for memory efficiency.
  warn(
/home/aubjpm001/.conda/envs/portsdfl-predict/lib/python3.11/site-packages/pytorch_tabular/models/common/layers/soft_trees.py:138: UserWarning: Data-aware initialization is performed on less than 1000 data points. This may cause instability.To avoid potential problems, run this model on a data batch with at least 1000 data samples.You can do so manually before training. Use with torch.no_grad() for memory efficiency.
  warn(
/home/aubjpm001/.conda/envs/portsdfl-predict/lib/python3.11/site-packages/pytorch_tabular/models/common/layers/soft_trees.py:138: UserWarning: Data-aware initialization is performed on less than 1000 data points. This may cause instability.To avoid potential problems, run this model on a data batch with at least 1000 data samples.You can do so manually before training. Use with torch.no_grad() for memory efficiency.
  warn(
/home/aubjpm001/.conda/envs/portsdfl-predict/lib/python3.11/site-packages/pytorch_tabular/models/common/layers/soft_trees.py:138: UserWarning: Data-aware initialization is performed on less than 1000 data points. This may cause instability.To avoid potential problems, run this model on a data batch with at least 1000 data samples.You can do so manually before training. Use with torch.no_grad() for memory efficiency.
  warn(
[I 2026-06-28 13:36:06,604] Trial 6 finished with value: 12.038193846404459 and parameters: {'n_layers': 4, 'n_trees': 128, 'tree_depth': 6, 'choice_function': 'sparsemax', 'lr': 0.00034889766548903674, 'weight_decay': 0.0003063462210622083}. Best is trial 2 with value: 11.961620532345943.
/home/aubjpm001/.conda/envs/portsdfl-predict/lib/python3.11/site-packages/pytorch_tabular/models/common/layers/soft_trees.py:138: UserWarning: Data-aware initialization is performed on less than 1000 data points. This may cause instability.To avoid potential problems, run this model on a data batch with at least 1000 data samples.You can do so manually before training. Use with torch.no_grad() for memory efficiency.
  warn(
/home/aubjpm001/.conda/envs/portsdfl-predict/lib/python3.11/site-packages/pytorch_tabular/models/common/layers/soft_trees.py:138: UserWarning: Data-aware initialization is performed on less than 1000 data points. This may cause instability.To avoid potential problems, run this model on a data batch with at least 1000 data samples.You can do so manually before training. Use with torch.no_grad() for memory efficiency.
  warn(
/home/aubjpm001/.conda/envs/portsdfl-predict/lib/python3.11/site-packages/pytorch_tabular/models/common/layers/soft_trees.py:138: UserWarning: Data-aware initialization is performed on less than 1000 data points. This may cause instability.To avoid potential problems, run this model on a data batch with at least 1000 data samples.You can do so manually before training. Use with torch.no_grad() for memory efficiency.
  warn(
/home/aubjpm001/.conda/envs/portsdfl-predict/lib/python3.11/site-packages/pytorch_tabular/models/common/layers/soft_trees.py:138: UserWarning: Data-aware initialization is performed on less than 1000 data points. This may cause instability.To avoid potential problems, run this model on a data batch with at least 1000 data samples.You can do so manually before training. Use with torch.no_grad() for memory efficiency.
  warn(
/home/aubjpm001/.conda/envs/portsdfl-predict/lib/python3.11/site-packages/pytorch_tabular/models/common/layers/soft_trees.py:138: UserWarning: Data-aware initialization is performed on less than 1000 data points. This may cause instability.To avoid potential problems, run this model on a data batch with at least 1000 data samples.You can do so manually before training. Use with torch.no_grad() for memory efficiency.
  warn(
