
The following have been reloaded with a version change:
  1) cuda/12.6.0_rocky9 => cuda/11.8.0       4) mpc/1.1.0-mheibzt => mpc/1.3.1
  2) gcc/11.3.0-o2cd4vz => gcc/9.5.0_all     5) mpfr/3.1.6-3ojkize => mpfr/4.2.0
  3) gmp/6.2.1-sh44noy => gmp/6.2.1

[Sun Jun 28 12:41:09 CDT 2026] Training 'rf' on asaxg005 | data=/home/aubjpm001/portsDFL/data/training_dataset.csv
2026-06-28 12:41:14,030 INFO Loading dataset...
2026-06-28 12:41:14,059 INFO rows=5589 folds=5 models=['rf']
2026-06-28 12:41:14,064 INFO === rf (tree, 100 trials) ===
[I 2026-06-28 12:41:14,637] A new study created in RDB with name: rf
[I 2026-06-28 12:41:17,861] Trial 0 finished with value: 12.588363314113746 and parameters: {'n_estimators': 500, 'max_features': 'sqrt', 'min_samples_leaf': 18, 'max_depth': 30, 'min_samples_split': 17}. Best is trial 0 with value: 12.588363314113746.
[I 2026-06-28 12:41:20,019] Trial 1 finished with value: 12.539978971528674 and parameters: {'n_estimators': 300, 'max_features': 'log2', 'min_samples_leaf': 13, 'max_depth': 30, 'min_samples_split': 16}. Best is trial 1 with value: 12.539978971528674.
[I 2026-06-28 12:41:21,959] Trial 2 pruned. 
[I 2026-06-28 12:41:26,646] Trial 3 finished with value: 12.220627284569842 and parameters: {'n_estimators': 800, 'max_features': 'log2', 'min_samples_leaf': 7, 'max_depth': 30, 'min_samples_split': 16}. Best is trial 3 with value: 12.220627284569842.
[I 2026-06-28 12:41:28,778] Trial 4 finished with value: 12.080540485542503 and parameters: {'n_estimators': 300, 'max_features': 'sqrt', 'min_samples_leaf': 7, 'max_depth': 20, 'min_samples_split': 7}. Best is trial 4 with value: 12.080540485542503.
[I 2026-06-28 12:41:33,722] Trial 5 finished with value: 11.787617001339584 and parameters: {'n_estimators': 800, 'max_features': 'log2', 'min_samples_leaf': 1, 'max_depth': None, 'min_samples_split': 3}. Best is trial 5 with value: 11.787617001339584.
[I 2026-06-28 12:41:37,662] Trial 6 pruned. 
[I 2026-06-28 12:41:40,220] Trial 7 pruned. 
[I 2026-06-28 12:41:41,957] Trial 8 pruned. 
[I 2026-06-28 12:41:44,534] Trial 9 pruned. 
[I 2026-06-28 12:41:46,889] Trial 10 pruned. 
[I 2026-06-28 12:41:52,317] Trial 11 finished with value: 11.948086070470232 and parameters: {'n_estimators': 300, 'max_features': 1.0, 'min_samples_leaf': 1, 'max_depth': None, 'min_samples_split': 6}. Best is trial 5 with value: 11.787617001339584.
[I 2026-06-28 12:41:56,607] Trial 12 pruned. 
[I 2026-06-28 12:42:01,567] Trial 13 finished with value: 11.825031756751638 and parameters: {'n_estimators': 300, 'max_features': 1.0, 'min_samples_leaf': 3, 'max_depth': None, 'min_samples_split': 8}. Best is trial 5 with value: 11.787617001339584.
[I 2026-06-28 12:42:12,851] Trial 14 finished with value: 11.805674423467195 and parameters: {'n_estimators': 800, 'max_features': 1.0, 'min_samples_leaf': 4, 'max_depth': None, 'min_samples_split': 10}. Best is trial 5 with value: 11.787617001339584.
[I 2026-06-28 12:42:19,081] Trial 15 finished with value: 11.946127350896635 and parameters: {'n_estimators': 800, 'max_features': 0.5, 'min_samples_leaf': 10, 'max_depth': None, 'min_samples_split': 20}. Best is trial 5 with value: 11.787617001339584.
[I 2026-06-28 12:42:22,858] Trial 16 pruned. 
[I 2026-06-28 12:42:26,656] Trial 17 pruned. 
[I 2026-06-28 12:42:37,786] Trial 18 finished with value: 11.815983056878853 and parameters: {'n_estimators': 800, 'max_features': 1.0, 'min_samples_leaf': 5, 'max_depth': None, 'min_samples_split': 10}. Best is trial 5 with value: 11.787617001339584.
[I 2026-06-28 12:42:40,216] Trial 19 pruned. 
[I 2026-06-28 12:42:44,225] Trial 20 pruned. 
[I 2026-06-28 12:42:52,743] Trial 21 pruned. 
[I 2026-06-28 12:43:04,877] Trial 22 finished with value: 11.804416203986728 and parameters: {'n_estimators': 800, 'max_features': 1.0, 'min_samples_leaf': 3, 'max_depth': None, 'min_samples_split': 4}. Best is trial 5 with value: 11.787617001339584.
[I 2026-06-28 12:43:18,002] Trial 23 finished with value: 11.82224302738398 and parameters: {'n_estimators': 800, 'max_features': 1.0, 'min_samples_leaf': 2, 'max_depth': None, 'min_samples_split': 4}. Best is trial 5 with value: 11.787617001339584.
[I 2026-06-28 12:43:21,933] Trial 24 pruned. 
[I 2026-06-28 12:43:27,712] Trial 25 pruned. 
[I 2026-06-28 12:43:38,231] Trial 26 pruned. 
[I 2026-06-28 12:43:41,971] Trial 27 pruned. 
[I 2026-06-28 12:43:49,065] Trial 28 finished with value: 11.730018984096468 and parameters: {'n_estimators': 800, 'max_features': 0.5, 'min_samples_leaf': 4, 'max_depth': 30, 'min_samples_split': 3}. Best is trial 28 with value: 11.730018984096468.
[I 2026-06-28 12:43:50,777] Trial 29 pruned. 
[I 2026-06-28 12:43:53,190] Trial 30 pruned. 
[I 2026-06-28 12:44:00,340] Trial 31 finished with value: 11.730018984096468 and parameters: {'n_estimators': 800, 'max_features': 0.5, 'min_samples_leaf': 4, 'max_depth': 30, 'min_samples_split': 3}. Best is trial 28 with value: 11.730018984096468.
[I 2026-06-28 12:44:08,340] Trial 32 finished with value: 11.699453023604935 and parameters: {'n_estimators': 800, 'max_features': 0.5, 'min_samples_leaf': 2, 'max_depth': 30, 'min_samples_split': 3}. Best is trial 32 with value: 11.699453023604935.
[I 2026-06-28 12:44:16,229] Trial 33 finished with value: 11.699453023604935 and parameters: {'n_estimators': 800, 'max_features': 0.5, 'min_samples_leaf': 2, 'max_depth': 30, 'min_samples_split': 3}. Best is trial 32 with value: 11.699453023604935.
[I 2026-06-28 12:44:22,980] Trial 34 finished with value: 11.793826756139852 and parameters: {'n_estimators': 800, 'max_features': 0.5, 'min_samples_leaf': 6, 'max_depth': 30, 'min_samples_split': 5}. Best is trial 32 with value: 11.699453023604935.
[I 2026-06-28 12:44:31,035] Trial 35 finished with value: 11.699453023604935 and parameters: {'n_estimators': 800, 'max_features': 0.5, 'min_samples_leaf': 2, 'max_depth': 30, 'min_samples_split': 3}. Best is trial 32 with value: 11.699453023604935.
[I 2026-06-28 12:44:38,750] Trial 36 finished with value: 11.708989061333126 and parameters: {'n_estimators': 800, 'max_features': 0.5, 'min_samples_leaf': 2, 'max_depth': 30, 'min_samples_split': 6}. Best is trial 32 with value: 11.699453023604935.
[I 2026-06-28 12:44:43,760] Trial 37 finished with value: 11.732976669369005 and parameters: {'n_estimators': 500, 'max_features': 0.5, 'min_samples_leaf': 2, 'max_depth': 30, 'min_samples_split': 7}. Best is trial 32 with value: 11.699453023604935.
[I 2026-06-28 12:44:51,445] Trial 38 finished with value: 11.708989061333126 and parameters: {'n_estimators': 800, 'max_features': 0.5, 'min_samples_leaf': 2, 'max_depth': 30, 'min_samples_split': 6}. Best is trial 32 with value: 11.699453023604935.
[I 2026-06-28 12:44:59,263] Trial 39 finished with value: 11.793199541962496 and parameters: {'n_estimators': 800, 'max_features': 0.5, 'min_samples_leaf': 1, 'max_depth': 30, 'min_samples_split': 7}. Best is trial 32 with value: 11.699453023604935.
[I 2026-06-28 12:45:02,183] Trial 40 finished with value: 11.795333097584363 and parameters: {'n_estimators': 300, 'max_features': 0.5, 'min_samples_leaf': 6, 'max_depth': 30, 'min_samples_split': 2}. Best is trial 32 with value: 11.699453023604935.
[I 2026-06-28 12:45:09,882] Trial 41 finished with value: 11.708989061333126 and parameters: {'n_estimators': 800, 'max_features': 0.5, 'min_samples_leaf': 2, 'max_depth': 30, 'min_samples_split': 6}. Best is trial 32 with value: 11.699453023604935.
[I 2026-06-28 12:45:17,720] Trial 42 finished with value: 11.706185566877057 and parameters: {'n_estimators': 800, 'max_features': 0.5, 'min_samples_leaf': 2, 'max_depth': 30, 'min_samples_split': 5}. Best is trial 32 with value: 11.699453023604935.
[I 2026-06-28 12:45:25,882] Trial 43 finished with value: 11.774467402912908 and parameters: {'n_estimators': 800, 'max_features': 0.5, 'min_samples_leaf': 1, 'max_depth': 30, 'min_samples_split': 5}. Best is trial 32 with value: 11.699453023604935.
[I 2026-06-28 12:45:28,242] Trial 44 pruned. 
[I 2026-06-28 12:45:32,108] Trial 45 pruned. 
[I 2026-06-28 12:45:37,398] Trial 46 finished with value: 11.786260203204723 and parameters: {'n_estimators': 500, 'max_features': 0.5, 'min_samples_leaf': 1, 'max_depth': 20, 'min_samples_split': 5}. Best is trial 32 with value: 11.699453023604935.
[I 2026-06-28 12:45:40,490] Trial 47 finished with value: 11.75964786630735 and parameters: {'n_estimators': 300, 'max_features': 0.5, 'min_samples_leaf': 5, 'max_depth': 30, 'min_samples_split': 8}. Best is trial 32 with value: 11.699453023604935.
[I 2026-06-28 12:45:47,963] Trial 48 finished with value: 11.703221435297488 and parameters: {'n_estimators': 800, 'max_features': 0.5, 'min_samples_leaf': 3, 'max_depth': 30, 'min_samples_split': 3}. Best is trial 32 with value: 11.699453023604935.
[I 2026-06-28 12:45:52,060] Trial 49 pruned. 
[I 2026-06-28 12:45:59,222] Trial 50 finished with value: 11.730018984096468 and parameters: {'n_estimators': 800, 'max_features': 0.5, 'min_samples_leaf': 4, 'max_depth': 30, 'min_samples_split': 3}. Best is trial 32 with value: 11.699453023604935.
[I 2026-06-28 12:46:07,292] Trial 51 finished with value: 11.699453023604935 and parameters: {'n_estimators': 800, 'max_features': 0.5, 'min_samples_leaf': 2, 'max_depth': 30, 'min_samples_split': 4}. Best is trial 32 with value: 11.699453023604935.
[I 2026-06-28 12:46:13,955] Trial 52 pruned. 
[I 2026-06-28 12:46:21,886] Trial 53 finished with value: 11.698150454241249 and parameters: {'n_estimators': 800, 'max_features': 0.5, 'min_samples_leaf': 2, 'max_depth': 20, 'min_samples_split': 3}. Best is trial 53 with value: 11.698150454241249.
[I 2026-06-28 12:46:29,313] Trial 54 finished with value: 11.707879228318717 and parameters: {'n_estimators': 800, 'max_features': 0.5, 'min_samples_leaf': 3, 'max_depth': 20, 'min_samples_split': 2}. Best is trial 53 with value: 11.698150454241249.
[I 2026-06-28 12:46:32,416] Trial 55 finished with value: 11.732497783514791 and parameters: {'n_estimators': 300, 'max_features': 0.5, 'min_samples_leaf': 4, 'max_depth': 20, 'min_samples_split': 3}. Best is trial 53 with value: 11.698150454241249.
[I 2026-06-28 12:46:37,907] Trial 56 pruned. 
[I 2026-06-28 12:46:42,270] Trial 57 pruned. 
[I 2026-06-28 12:46:44,828] Trial 58 pruned. 
[I 2026-06-28 12:46:52,235] Trial 59 finished with value: 11.707879228318717 and parameters: {'n_estimators': 800, 'max_features': 0.5, 'min_samples_leaf': 3, 'max_depth': 20, 'min_samples_split': 3}. Best is trial 53 with value: 11.698150454241249.
[I 2026-06-28 12:46:54,773] Trial 60 pruned. 
[I 2026-06-28 12:47:02,550] Trial 61 finished with value: 11.706185566877057 and parameters: {'n_estimators': 800, 'max_features': 0.5, 'min_samples_leaf': 2, 'max_depth': 30, 'min_samples_split': 5}. Best is trial 53 with value: 11.698150454241249.
[I 2026-06-28 12:47:09,647] Trial 62 finished with value: 11.730018984096468 and parameters: {'n_estimators': 800, 'max_features': 0.5, 'min_samples_leaf': 4, 'max_depth': 30, 'min_samples_split': 2}. Best is trial 53 with value: 11.698150454241249.
[I 2026-06-28 12:47:16,565] Trial 63 pruned. 
[I 2026-06-28 12:47:24,019] Trial 64 finished with value: 11.703221435297488 and parameters: {'n_estimators': 800, 'max_features': 0.5, 'min_samples_leaf': 3, 'max_depth': 30, 'min_samples_split': 4}. Best is trial 53 with value: 11.698150454241249.
[I 2026-06-28 12:47:31,536] Trial 65 finished with value: 11.703221435297488 and parameters: {'n_estimators': 800, 'max_features': 0.5, 'min_samples_leaf': 3, 'max_depth': 30, 'min_samples_split': 4}. Best is trial 53 with value: 11.698150454241249.
[I 2026-06-28 12:47:34,063] Trial 66 pruned. 
[I 2026-06-28 12:47:38,725] Trial 67 pruned. 
[I 2026-06-28 12:47:39,650] Trial 68 pruned. 
[I 2026-06-28 12:47:46,833] Trial 69 finished with value: 11.730018984096468 and parameters: {'n_estimators': 800, 'max_features': 0.5, 'min_samples_leaf': 4, 'max_depth': 30, 'min_samples_split': 6}. Best is trial 53 with value: 11.698150454241249.
[I 2026-06-28 12:47:49,698] Trial 70 pruned. 
[I 2026-06-28 12:47:57,183] Trial 71 finished with value: 11.703221435297488 and parameters: {'n_estimators': 800, 'max_features': 0.5, 'min_samples_leaf': 3, 'max_depth': 30, 'min_samples_split': 4}. Best is trial 53 with value: 11.698150454241249.
[I 2026-06-28 12:48:05,162] Trial 72 finished with value: 11.699453023604935 and parameters: {'n_estimators': 800, 'max_features': 0.5, 'min_samples_leaf': 2, 'max_depth': 30, 'min_samples_split': 4}. Best is trial 53 with value: 11.698150454241249.
[I 2026-06-28 12:48:13,097] Trial 73 finished with value: 11.706185566877057 and parameters: {'n_estimators': 800, 'max_features': 0.5, 'min_samples_leaf': 2, 'max_depth': 30, 'min_samples_split': 5}. Best is trial 53 with value: 11.698150454241249.
[I 2026-06-28 12:48:20,065] Trial 74 pruned. 
[I 2026-06-28 12:48:28,018] Trial 75 finished with value: 11.699453023604935 and parameters: {'n_estimators': 800, 'max_features': 0.5, 'min_samples_leaf': 2, 'max_depth': 30, 'min_samples_split': 2}. Best is trial 53 with value: 11.698150454241249.
[I 2026-06-28 12:48:32,068] Trial 76 pruned. 
[I 2026-06-28 12:48:37,434] Trial 77 finished with value: 11.699447439245825 and parameters: {'n_estimators': 500, 'max_features': 0.5, 'min_samples_leaf': 2, 'max_depth': 30, 'min_samples_split': 2}. Best is trial 53 with value: 11.698150454241249.
[I 2026-06-28 12:48:39,148] Trial 78 pruned. 
[I 2026-06-28 12:48:44,427] Trial 79 finished with value: 11.699447439245825 and parameters: {'n_estimators': 500, 'max_features': 0.5, 'min_samples_leaf': 2, 'max_depth': 30, 'min_samples_split': 2}. Best is trial 53 with value: 11.698150454241249.
[I 2026-06-28 12:48:48,626] Trial 80 pruned. 
[I 2026-06-28 12:48:53,899] Trial 81 finished with value: 11.699447439245825 and parameters: {'n_estimators': 500, 'max_features': 0.5, 'min_samples_leaf': 2, 'max_depth': 30, 'min_samples_split': 2}. Best is trial 53 with value: 11.698150454241249.
[I 2026-06-28 12:48:59,147] Trial 82 finished with value: 11.699447439245825 and parameters: {'n_estimators': 500, 'max_features': 0.5, 'min_samples_leaf': 2, 'max_depth': 30, 'min_samples_split': 2}. Best is trial 53 with value: 11.698150454241249.
[I 2026-06-28 12:49:02,885] Trial 83 pruned. 
[I 2026-06-28 12:49:08,162] Trial 84 finished with value: 11.699447439245825 and parameters: {'n_estimators': 500, 'max_features': 0.5, 'min_samples_leaf': 2, 'max_depth': 30, 'min_samples_split': 3}. Best is trial 53 with value: 11.698150454241249.
[I 2026-06-28 12:49:10,542] Trial 85 pruned. 
[I 2026-06-28 12:49:13,187] Trial 86 pruned. 
[I 2026-06-28 12:49:16,922] Trial 87 pruned. 
[I 2026-06-28 12:49:21,859] Trial 88 finished with value: 11.693648590601962 and parameters: {'n_estimators': 500, 'max_features': 0.5, 'min_samples_leaf': 3, 'max_depth': 30, 'min_samples_split': 2}. Best is trial 88 with value: 11.693648590601962.
[I 2026-06-28 12:49:25,533] Trial 89 pruned. 
[I 2026-06-28 12:49:31,850] Trial 90 pruned. 
[I 2026-06-28 12:49:34,215] Trial 91 pruned. 
[I 2026-06-28 12:49:39,508] Trial 92 finished with value: 11.699447439245825 and parameters: {'n_estimators': 500, 'max_features': 0.5, 'min_samples_leaf': 2, 'max_depth': 30, 'min_samples_split': 3}. Best is trial 88 with value: 11.693648590601962.
[I 2026-06-28 12:49:44,591] Trial 93 finished with value: 11.693648590601962 and parameters: {'n_estimators': 500, 'max_features': 0.5, 'min_samples_leaf': 3, 'max_depth': 30, 'min_samples_split': 2}. Best is trial 88 with value: 11.693648590601962.
[I 2026-06-28 12:49:49,494] Trial 94 finished with value: 11.693648590601962 and parameters: {'n_estimators': 500, 'max_features': 0.5, 'min_samples_leaf': 3, 'max_depth': 30, 'min_samples_split': 2}. Best is trial 88 with value: 11.693648590601962.
[I 2026-06-28 12:49:54,438] Trial 95 finished with value: 11.693648590601962 and parameters: {'n_estimators': 500, 'max_features': 0.5, 'min_samples_leaf': 3, 'max_depth': 30, 'min_samples_split': 2}. Best is trial 88 with value: 11.693648590601962.
[I 2026-06-28 12:49:58,229] Trial 96 pruned. 
[I 2026-06-28 12:50:03,228] Trial 97 finished with value: 11.693648590601962 and parameters: {'n_estimators': 500, 'max_features': 0.5, 'min_samples_leaf': 3, 'max_depth': 30, 'min_samples_split': 2}. Best is trial 88 with value: 11.693648590601962.
[I 2026-06-28 12:50:04,619] Trial 98 pruned. 
[I 2026-06-28 12:50:06,275] Trial 99 pruned. 
2026-06-28 12:50:06,306 INFO [rf] best trial #88  MAE=11.694h
2026-06-28 12:50:07,219 INFO [rf] fold 1/5  MAE=11.51h
2026-06-28 12:50:08,135 INFO [rf] fold 2/5  MAE=11.61h
2026-06-28 12:50:09,048 INFO [rf] fold 3/5  MAE=11.79h
2026-06-28 12:50:09,971 INFO [rf] fold 4/5  MAE=11.57h
2026-06-28 12:50:10,893 INFO [rf] fold 5/5  MAE=12.04h
2026-06-28 12:50:12,189 INFO [rf] saved -> /home/aubjpm001/portsDFL/prediction_models/artifacts/rf.pkl  (CV MAE 11.705 h)
2026-06-28 12:50:12,189 INFO Done. Artifacts in /home/aubjpm001/portsDFL/prediction_models/artifacts ; run scripts/compare.py for the leaderboard.
